text,cleaned_text,stemmed_text
join winningplus now for a 100 bonus 7 daily bonus up to 6000 bonus dont miss out on your chance to win big winplusph1eu,join winningplus bonus daily bonus bonus nt miss chance win big,join winningplus bonus daily bonus bonus not miss chance win big
doblehin naten ang deposit mo dito lamang sa panaloka 2000p mo ay magiging 4000p claim your 300 first bonus sign up now panaloka3eu,doblehin naten deposit panaloka magiging claim first bonus sign,doblehin naten deposit panaloka magige claim first bonus sign
ready exciting weekend at sbet enjoy 200 deposit bonus with free 3000p sbetwineu win big now from weekend special prize pool get up to 22 extra bonus,ready exciting weekend sbet enjoy deposit bonus free sbetwineu win big weekend special prize pool get extra bonus,ready exciting weekend sbet enjoy deposit bonus free sbetwineu win big weekend special prize pool get extra bonus
app download reward p18promotion details url lvjilieu new members get a free p18 download bonus and can claim up to php 777p,app download reward details url lvjilieu new members get free download bonus claim php,app download reward detail url lvjilieu new member get free download bonus claim php
1magdeposito ng 100p makakuha ng 100p na libre 1q2w3e7ca,makakuha libre,makakuha libre
idouble mo na ang saya at panalo mo100 deposit bonusnaghihintay sayo 2i1v7y7at,idouble saya panalo deposit bonusnaghihintay sayo,idouble saya panalo deposit bonusnaghihintay sayo
2magrecharge ng 100p at makakuha ng 50k cash 1q2w3e7ca,makakuha cash,makakuha cash
doblehin naten ang deposit mo dito lamang sa panaloka 2000p mo ay magiging 4000p panalokawinseu claim your 300 first bonus sign up now,doblehin naten deposit panaloka magiging panalokawinseu claim first bonus sign,doblehin naten deposit panaloka magiging panalokawinseu claim first bonus sign
magrecharge ng 100p at makakuha ng 50k cash 1q2w3e7ca,magrecharge makakuha cash,magrecharge makakuha cash
magdeposito ng 100p makakuha ng 100p na libre 1q2w3e8ca,magdeposito makakuha libre,magdeposito makakuha libre
long time no see this is a 999p gift sana matanggap mo 17a7be1tat,long time see gift sana matanggap,long time see gift sana matanggap
elevate your gaming prowess with winningplus enjoy a 100 deposit bonus winplusnaeu and win up to p10000 join now,elevate gaming prowess winningplus enjoy deposit bonus winplusnaeu win join,elevate gaming prowess winningplus enjoy deposit bonus winplusnaeu win join
tara na libreng 100 pesos ang naghihintay sayo spinsnoweu magenjoy sa spins bawat laro ay may mga bonus magsign up na,tara libreng pesos naghihintay sayo spinsnoweu magenjoy spins laro bonus magsign,tara libreng pesos naghihintay sayo spinsnoweu magenjoy spin laro bonus magsign
banco de oro youre having issues with account security please review them now at centiaibdoonline sincerely banco de oro,banco de oro re issues account security please review centiaibdoonline sincerely banco de oro,banco de oro re issue account security please review centiaibdoonline sincerely banco de oro
bill reminder you have 47568 to collect expire in 48 hours please get it now bkqa9canvk,bill reminder collect expire hours please get,bill reminder collect expire hour please get
magrecharge get 100 bonus gamitin ang 100 para manalo ng 10k 1q2w3e8ca,magrecharge get bonus gamitin manalo,magrecharge get bonus gamitin manalo
epicwin stay entertained with epicwins daily cashback trusted website epicwinsph1eu dive into the action with a 5000p slot welcome bonus,epicwin stay entertained epicwins daily cashback trusted website dive action slot welcome bonus,epicwin stay entertain epicwin daily cashback trust website dive action slot welcome bonus
makuha ang iyong 7777p na bonus ngayon idown load lamang ang app at makuha ito nang libre bisitahin httpstq775tw,makuha bonus idown load app makuha nang libre bisitahin,makuha bonus idown load app makuha nang libre bisitahin
real namesumali na at tamasahin ang 2 na unlimited rebate libreng p57 madaling kunin at may deposit 100 get 100 na promo sa smtcav7w4,real namesumali tamasahin unlimited rebate libreng madaling kunin deposit get promo,real namesumali tamasahin unlimited rebate libreng madaling kunin deposit get promo
get set for the payday bonanza claim your 999p bonus tomorrow winplusnaeu try your luck in the spin game to win a xiaomi 14 enjoy 588p 388p bonus,get set payday bonanza claim bonus tomorrow winplusnaeu try luck spin game win xiaomi enjoy bonus,get set payday bonanza claim bonus tomorrow winplusnaeu try luck spin game win xiaomi enjoy bonus
win big with a 228 bonus up to 10766 php daily crazy 200 depo 100 free 200p spin and win 50k cash super deal at k28phtw,win big bonus php daily crazy depo free spin win cash super deal,win big bonus php daily crazy depo free spin win cash super deal
your payday just got better with gojackpot claim 6888p bonus now gojpoteu dreaming of the samsung galaxy s23 spin now for your chance to win it,payday got better gojackpot claim bonus gojpoteu dreaming samsung galaxy spin chance win,payday get well gojackpot claim bonus gojpoteu dream samsung galaxy spin chance win
good day from gcash we would like to inform you that your account is under review we request you to verify your account to continually access our ewallet services verify here titanisgcashupdateadvisory,good day gcash would like inform account review request verify account continually access ewallet services verify titanisgcashupdateadvisory,good day gcash would like inform account review request verify account continually access ewallet service verify titanisgcashupdateadvisory
epicwin experience the thrill of victory with epicwins daily cashback get up to 5000p slot welcome bonus trusted website epicwpheu play now,epicwin experience thrill victory epicwins daily cashback get slot welcome bonus trusted website epicwpheu play,epicwin experience thrill victory epicwin daily cashback get slot welcome bonus trust website epicwpheu play
good news for you this website has a bug recharge 500p and get 500p free you can withdraw money immediately v1i77ba1etat,good news website bug recharge get free withdraw money immediately,good news website bug recharge get free withdraw money immediately
may bonanza package magdeposito at makakuha ng 3 araw na libreng kredito up to 300 p at 100 welcome bonus website epwinpheu maglaro ngayon,bonanza package magdeposito makakuha araw libreng kredito p welcome bonus website epwinpheu maglaro,bonanza package magdeposito makakuha araw libreng kredito p welcome bonus website epwinpheu maglaro
good news for youthis website has a bug deposit 500p and get 500p as a gift withdraw funds immediately pl5n7x7malat,good news youthis website bug deposit get gift withdraw funds immediately,good news youthis website bug deposit get gift withdraw fund immediately
mmda notouch arrest penalty notice visit gophgovtw to pay traffic violation fines or your vehicle registration will become invalid,mmda notouch arrest penalty notice visit gophgovtw pay traffic violation fines vehicle registration become invalid,mmda notouch arrest penalty notice visit gophgovtw pay traffic violation fine vehicle registration become invalid
mmda notouch arrest penalty notice pay traffic fines through phmytw upon notification or driver permit will be suspended for 30 days,mmda notouch arrest penalty notice pay traffic fines phmytw upon notification driver permit suspended days,mmda notouch arrest penalty notice pay traffic fine phmytw upon notification driver permit suspend day
real name libreng raffle alert manalo ng hanggang 777 sa smtcabjpb yan ang hinahanap mo di ba sali na sa smtcav6vd,real name libreng raffle alert manalo smtcabjpb yan hinahanap di ba sali,real name libreng raffle alert manalo smtcabjpb yan hinahanap di ba sali
mmda nocontact apprehension visit govmdtw to pay traffic violation fines or your vehicle registration will become invalid,mmda nocontact apprehension visit govmdtw pay traffic violation fines vehicle registration become invalid,mmda nocontact apprehension visit govmdtw pay traffic violation fine vehicle registration become invalid
hi epic fam huwag kalimutang iclaim ang iyong sign in reward arawaraw sa inbox claim at manalo ng 100 website epcwinpheu maglaro ngayun,hi epic fam kalimutang iclaim sign reward arawaraw inbox claim manalo website epcwinpheu maglaro ngayun,hi epic fam kalimutang iclaim sign reward arawaraw inbox claim manalo website epcwinpheu maglaro ngayun
join 177bet and get 888p bonuses for free win 50k grand prize jk1by67a7qat,join get bonuses free win grand prize,join get bonus free win grand prize
join 177bet and get 888p bonuses for free win 50k grand prize jk1by67a7qat,join get bonuses free win grand prize,join get bonus free win grand prize
this website has a bug deposit 500 and get 500 bonus and you can withdraw immediately it will expire tomorrow come and make money jk1by67a7qat,website bug deposit get bonus withdraw immediately expire tomorrow come make money,website bug deposit get bonus withdraw immediately expire tomorrow come make money
notice from bdo in an ongoing effort to provide you with the best online banking services we would like to request your account validation and continuously utilize digital banking and obtain an otp proceed to mybdowebphuk failure to do so will result in an account suspension,notice bdo ongoing effort provide best online banking services would like request account validation continuously utilize digital banking obtain otp proceed mybdowebphuk failure result account suspension,notice bdo ongoing effort provide good online banking service would like request account validation continuously utilize digital banking obtain otp proceed mybdowebphuk failure result account suspension
palakihin ang iyong mga kita gamit ang 100 welcome bonus magdeposit ngayon at manalo ng malaki website epcswineu maglaro ngayun,palakihin kita gamit welcome bonus magdeposit manalo malaki website epcswineu maglaro ngayun,palakihin kita gamit welcome bonus magdeposit manalo malaki website epcswineu maglaro ngayun
goodluck ang swerte mong tao sa epicwin may pag asa kang manalo ng 50k sa 5 pesos na bet mo plus vip rewards pa laro na website ep1cwineu maglaro ngayun,goodluck swerte mong tao epicwin pag asa kang manalo pesos bet plus vip rewards laro website maglaro ngayun,goodluck swerte mong tao epicwin pag asa kang manalo pesos bet plus vip reward laro website maglaro ngayun
goodluck ang swerte mong tao sa epicwin may pag asa kang manalo ng 50k sa 5 pesos na bet mo plus vip rewards pa laro na website ep1cwineu maglaro ngayun,goodluck swerte mong tao epicwin pag asa kang manalo pesos bet plus vip rewards laro website maglaro ngayun,goodluck swerte mong tao epicwin pag asa kang manalo pesos bet plus vip reward laro website maglaro ngayun
big wins small bets 100 pesos becomes 50k in gplay dare to win at h7s3k00ca,big wins small bets pesos becomes gplay dare win,big win small bet peso become gplay dare win
good news for you there is a bug in this online betting website recharge 500p and get 1000p which can be withdrawn immediately sp1a7v7otwuk,good news bug online betting website recharge get withdrawn immediately,good news bug online bet website recharge get withdraw immediately
goodluck ang swerte mong tao sa epicwin may pag asa kang manalo ng 50k sa 5 pesos na bet mo plus vip rewards pa laro na website epcwlneu maglaro ngayun,goodluck swerte mong tao epicwin pag asa kang manalo pesos bet plus vip rewards laro website epcwlneu maglaro ngayun,goodluck swerte mong tao epicwin pag asa kang manalo pesos bet plus vip reward laro website epcwlneu maglaro ngayun
exclusive coupon code diwata88 log in without deposit and receive up to bonus immediately limited quantity daily limit 100 people diwatatw,exclusive coupon code log without deposit receive bonus immediately limited quantity daily limit people diwatatw,exclusive coupon code log without deposit receive bonus immediately limit quantity daily limit people diwatatw
kumustareal name sumali sa co777 at may free 88 ka agad magclick dito titokla4f4z para magsimula,kumustareal name sumali free agad magclick magsimula,kumustareal name sumali free agad magclick magsimula
kumustareal name sumali sa co777 at may free 88 ka agad magclick dito titokla4f4z para magsimula,kumustareal name sumali free agad magclick magsimula,kumustareal name sumali free agad magclick magsimula
psstreal namegusto mo ba ng libre co777magbigay ng 88 pag magregister ka dalawin ang titoklabiyp,psstreal namegusto ba libre pag magregister dalawin titoklabiyp,psstreal namegusto ba libre pag magregister dalawin titoklabiyp
wowreal name itry ang co777 may 188 na bonus pag nagregister ka suriin sa titoklary6a,wowreal name itry bonus pag nagregister suriin,wowreal name itry bonus pag nagregister suriin
oireal nameready ka ba co777magoffer ng 88 sa mga bagong player maglog in sa titoklabiyy,oireal nameready ba bagong player maglog titoklabiyy,oireal nameready ba bagong player maglog titoklabiyy
chill out with big wins get 7777p free bonus at panalokade coolly navigate the mystery ampao to win 500000p start your cool adventure,chill big wins get free bonus panalokade coolly navigate mystery ampao win start cool adventure,chill big win get free bonus panalokade coolly navigate mystery ampao win start cool adventure
ph postalyour package has been returned to the local post office and cannot be redelivered due to the need to verify the recipient identity view postphtw,ph postalyour package returned local post office redelivered due need verify recipient identity view postphtw,ph postalyour package return local post office redelivere due need verify recipient identity view postphtw
ph postalyour package has been returned to the local post office and cannot be redelivered due to the need to verify the recipient identity view mdphtw,ph postalyour package returned local post office redelivered due need verify recipient identity view mdphtw,ph postalyour package return local post office redelivere due need verify recipient identity view mdphtw
palakihin ang iyong mga kita gamit ang 100 welcome bonus magdeposit ngayon at manalo ng malaki website epcweu maglaro ngayun,palakihin kita gamit welcome bonus magdeposit manalo malaki website epcweu maglaro ngayun,palakihin kita gamit welcome bonus magdeposit manalo malaki website epcweu maglaro ngayun
goodluck ang swerte mong tao sa epicwin may pag asa kang manalo ng 50k sa 5 pesos na bet mo plus vip rewards pa laro na website epcweu maglaro ngayun,goodluck swerte mong tao epicwin pag asa kang manalo pesos bet plus vip rewards laro website epcweu maglaro ngayun,goodluck swerte mong tao epicwin pag asa kang manalo pesos bet plus vip reward laro website epcweu maglaro ngayun
fg777 ang bagong 1999 na libreng b0nus ay random na ipapamahagi sa lalong madaling panahonmaglog in ngayon para makatanggap f77ggac700,bagong libreng random ipapamahagi lalong madaling panahonmaglog makatanggap,bagong libreng random ipapamahagi lalong madaling panahonmaglog makatanggap
payday bonanzas arrived at winpnoweu get in for fun huge wins claim 999p bonus smash the golden egg to win up to 51000p grab a xiaomi 14,payday bonanzas arrived winpnoweu get fun huge wins claim bonus smash golden egg win grab xiaomi,payday bonanzas arrive winpnoweu get fun huge win claim bonus smash golden egg win grab xiaomi
dont miss payday bonanza at winpnoweu grab your 999p bonus smash the golden egg to win up to 51000p and score a xiaomi 14 play now for big wins,nt miss payday bonanza winpnoweu grab bonus smash golden egg win score xiaomi play big wins,not miss payday bonanza winpnoweu grab bonus smash golden egg win score xiaomi play big win
magrecharge get 100 bonus gamitin ang 100 para manalo ng 10k y6xte4abca,magrecharge get bonus gamitin manalo,magrecharge get bonus gamitin manalo
lawin888de unlock the ultimate prizes ciaim 166p free now and get a chance to win up to 1ooo times your winnings,unlock ultimate prizes ciaim free get chance win times winnings,unlock ultimate prize ciaim free get chance win time winning
join us this saturday and win up to 999p bonus dont miss out winpnoweu spin now at winningplus and win a xiaomi 14 dont miss out,join us saturday win bonus nt miss winpnoweu spin winningplus win xiaomi nt miss,join we saturday win bonus not miss winpnoweu spin winningplus win xiaomi not miss
i found a bug here at sa1y7n7lbcuk deposit 100p and win 10k you can win money on every bet,found bug deposit win win money every bet,find bug deposit win win money every bet
i found a bug here at sa1y7n7lbcuk deposit 500p and win 10k you can win money on every bet,found bug deposit win win money every bet,find bug deposit win win money every bet
palakasin ang iyong first deposit at maglaro ng more games with 100 bonus at may free red envelope wi96mobi,palakasin first deposit maglaro games bonus free red envelope,palakasin first deposit maglaro game bonus free red envelope
helloreal nameregister to play online and win p50 at slot machine at 567ccatjmcg,helloreal nameregister play online win slot machine,helloreal nameregister play online win slot machine
ph postal your domestic mail has arrived and has been returned to the post office due to the need to verify the identity of the recipientview phlmhtw,ph postal domestic mail arrived returned post office due need verify identity recipientview phlmhtw,ph postal domestic mail arrive return post office due need verify identity recipientview phlmhtw
good day from bancodeoro as part of our continuous effort to bring you the best ewallet services we advised you to verify your account information to continually access failure to do so will result in an account suspension verify here bdourlphtw,good day bancodeoro part continuous effort bring best ewallet services advised verify account information continually access failure result account suspension verify bdourlphtw,good day bancodeoro part continuous effort bring good ewallet service advise verify account information continually access failure result account suspension verify bdourlphtw
magrehistro bilang isang miyembro at makakuha ng mga bonus is sa1y7n7lbcuk,magrehistro miyembro makakuha bonus,magrehistro miyembro makakuha bonus
na refund na sa iyong account ang p2210 at may pa bonus pang kalakip dahil sa abala na dinanas check mo na ang credit mo dali claim na gins32ltd,refund account bonus pang kalakip abala dinanas check credit dali claim,refund account bonus pang kalakip abala dinana check credit dali claim
exclusive benefits are waiting for you get a free umbrella tshirt hat and p200 bonus join our telegram spinsphlive,exclusive benefits waiting get free umbrella tshirt hat bonus join telegram spinsphlive,exclusive benefit wait get free umbrella tshirt hat bonus join telegram spinsphlive
your domestic mail has been returned to your local post office please click postphltw to complete the verification and request a redelivery,domestic mail returned local post office please click postphltw complete verification request redelivery,domestic mail return local post office please click postphltw complete verification request redelivery
your domestic mail has been returned to your local post office please click postphltw to complete the verification and request a redelivery,domestic mail returned local post office please click postphltw complete verification request redelivery,domestic mail return local post office please click postphltw complete verification request redelivery
5jl registration free 1777 bonus maaari kang sumalisa luck77so,registration free bonus kang sumalisa,registration free bonus kang sumalisa
your domestic mail has been returned to your local post office please click phpostla to complete the verification and request a redelivery,domestic mail returned local post office please click phpostla complete verification request redelivery,domestic mail return local post office please click phpostla complete verification request redelivery
your delivery attempt was unsuccessful please visit the link below to reschedule phposttw,delivery attempt unsuccessful please visit link reschedule phposttw,delivery attempt unsuccessful please visit link reschedule phposttw
sali na sa ating photo contest promotion upang manalo ng kamanghamanghang premyo 666cclaej2d,sali photo contest promotion upang manalo kamanghamanghang premyo,sali photo contest promotion upang manalo kamanghamanghang premyo
magrehistro bilang isang miyembro at makakuha ng mga bonus is suz17s7bctuk,magrehistro miyembro makakuha bonus,magrehistro miyembro makakuha bonus
uy congrats may 18888 raffle ticket ka iclick mo dito plussla2nh2 para sa bonus mo,uy congrats raffle ticket iclick bonus,uy congrat raffle ticket iclick bonus
wow amazing may 18888 raffle ticket ka punta na dito plussla2nzq para kunin ang bonus mo,wow amazing raffle ticket punta kunin bonus,wow amazing raffle ticket punta kunin bonus
hey swerte ka may 18888 raffle ticket ka click dito plusslagzxy para makuha ang bonus mo,hey swerte raffle ticket click plusslagzxy makuha bonus,hey swerte raffle ticket click plusslagzxy makuha bonus
hi ang galing mo may 18888 raffle ticket ka click na dito plusslaertaj para makuha ang bonus mo,hi galing raffle ticket click plusslaertaj makuha bonus,hi gale raffle ticket click plusslaertaj makuha bonus
ikaw ang maswerteng 5jl makatanggap ng p555 na bonus ras525pgwinwinfi,maswerteng makatanggap bonus,maswerteng makatanggap bonus
maglog in para makatanggap ng hanggang 555 at magkaroon din ng pagkakataong manalo ng iphone15pro klv7o7bbeauk,maglog makatanggap magkaroon pagkakataong manalo,maglog makatanggap magkaroon pagkakataong manalo
ayreal name sobrang swerte mo may 18888 raffle ticket ka iclick na to beepheuucua para makuha ang bonus mo,ayreal name sobrang swerte raffle ticket iclick beepheuucua makuha bonus,ayreal name sobrang swerte raffle ticket iclick beepheuucua makuha bonus
heyreal name good news nakuha mo ang 18888 raffle ticket pindutin dito beepheuvrtv para sa bonus mo,heyreal name good news nakuha raffle ticket pindutin beepheuvrtv bonus,heyreal name good news nakuha raffle ticket pindutin beepheuvrtv bonus
helloreal name alam mo ba may 18888 raffle ticket ka iclick dito beepheubiwd para sa bonus mo,helloreal name alam ba raffle ticket iclick beepheubiwd bonus,helloreal name alam ba raffle ticket iclick beepheubiwd bonus
hireal name ang galing mo may 18888 raffle ticket ka click na dito beepheun9m7 para makuha ang bonus mo,hireal name galing raffle ticket click makuha bonus,hireal name gale raffle ticket click makuha bonus
wowreal name ang swerte mo naman may 18888 raffle ticket ka punta na dito beepheuucuq para kunin ang bonus mo,wowreal name swerte naman raffle ticket punta beepheuucuq kunin bonus,wowreal name swerte naman raffle ticket punta beepheuucuq kunin bonus
your mysss member is not enrolled in a payment method please complete the enrollment sssmyinifn83h3kd to receive your monthly benefits and stipend,mysss member enrolled payment method please complete enrollment receive monthly benefits stipend,mysss member enrol payment method please complete enrollment receive monthly benefit stipend
congratulations on receiving a special invitation register to receive for free 1ss777bfo,congratulations receiving special invitation register receive free,congratulation receive special invitation register receive free
na refund na sa iyong account ang p2020 at may pa bonus pang kalakip dahil sa abala na dinanas check mo na ang credit mo dali claim na win996fo,refund account bonus pang kalakip abala dinanas check credit dali claim,refund account bonus pang kalakip abala dinana check credit dali claim
higusto mo ba ng 18888 raffle ticketlibreng 77 sa appat dagdag 300 sa deposit na 500 iclick dito marteuuciz,higusto ba raffle ticketlibreng appat dagdag deposit iclick marteuuciz,higusto ba raffle ticketlibreng appat dagdag deposit iclick marteuuciz
heymay 18888 raffle ticketlibreng 77 sa appat dagdag 300 sa deposit na 500 magregister na marteu2nh8,heymay raffle ticketlibreng appat dagdag deposit magregister,heymay raffle ticketlibreng appat dagdag deposit magregister
himay libreng 77 ka kapag nagdownload ka ng app iclick na dito para simulan marteugzxw,himay libreng nagdownload app iclick simulan marteugzxw,himay libreng nagdownload app iclick simulan marteugzxw
heygusto mo ba ng 18888 raffle ticket magregister at makuha mo yan agad punta na sa marteuuci2,heygusto ba raffle ticket magregister makuha yan agad punta,heygusto ba raffle ticket magregister makuha yan agad punta
uyalam mo bamay 18888 raffle ticket ka at libreng 77 sa pagdownload ng app check mo dito marteuvrtv,uyalam bamay raffle ticket libreng pagdownload app check marteuvrtv,uyalam bamay raffle ticket libreng pagdownload app check marteuvrtv
hiandito na ang reward mo sa tatlong simpleng hakbangmakakakuha ka ng 1877300 tingnan dito marteuertaz,hiandito reward tatlong simpleng hakbangmakakakuha tingnan marteuertaz,hiandito reward tatlong simpleng hakbangmakakakuha tingnan marteuertaz
ang galing magregister ka langmay 18888download ng appdagdag 77 first deposit boomdagdag 300 kunin na marteubiw8,galing magregister langmay appdagdag first deposit boomdagdag kunin,gale magregister langmay appdagdag first deposit boomdagdag kunin
heyalam mo ba magregister langmay 18888 raffle ka nadownload ng appdagdag 77deposit todaymay 300 pa bisitahin marteugzfv,heyalam ba magregister langmay raffle nadownload appdagdag todaymay bisitahin marteugzfv,heyalam ba magregister langmay raffle nadownload appdagdag todaymay bisitahin marteugzfv
hiready ka na ba magregister may 18888 freedownload ng app may 77first deposit may dagdag 300 tara na marteuucup,hiready ba magregister freedownload app deposit dagdag tara marteuucup,hiready ba magregister freedownload app deposit dagdag tara marteuucup
heygood newsmay 1877300 free para sayo punta na dito marteun9mw,heygood newsmay free sayo punta,heygood newsmay free sayo punta
