text,cleaned_text,stemmed_text
a new and green township will be rising in the south maple grove for the first time megaworld is offering a chance of a lifetime to acquire the most prime commercial lots in the rapidly developing business district of gen trias cavite lot sizes range from 440 to 1000 sqm with option to combine limited inventory only get yours at preselling prices today we are now accepting reservations for more details and information please contact andrew 63917689,new green township rising south maple grove first time megaworld offering chance lifetime acquire prime commercial lots rapidly developing business district gen trias cavite lot sizes range sqm option combine limited inventory get preselling prices today accepting reservations details information please contact andrew,new green township rise south maple grove first time megaworld offer chance lifetime acquire prime commercial lot rapidly develop business district gen trias cavite lot size range sqm option combine limited inventory get preselle price today accept reservation detail information please contact andrew
new office space for sale in ortigas avenue near the grove for inquiries please text your email text no to stop thank you jenn sam,new office space sale ortigas avenue near grove inquiries please text email text stop thank jenn sam,new office space sale ortigas avenue near grove inquiry please text email text stop thank jenn sam
celebrate the season of love with a sweet staycation and an intimate dinner for two by the poolside at your urban oasis edsa shangrila manila call 633 8888,celebrate season love sweet staycation intimate dinner two poolside urban oasis edsa shangrila manila call,celebrate season love sweet staycation intimate dinner two poolside urban oasis edsa shangrila manila call
shangrila updates risemakati oneofakind residential commercial development premier outstanding amenities prices start at 5m inquiries are welcome pls reply w your name email add for more details contact us infoshangrilapropertiesinccom wwwshangrilapropertiesinccomrisemakati,shangrila updates risemakati oneofakind residential commercial development premier outstanding amenities prices start m inquiries welcome pls reply w name email add details contact us infoshangrilapropertiesinccom wwwshangrilapropertiesinccomrisemakati,shangrila update risemakati oneofakind residential commercial development premier outstanding amenity price start m inquiry welcome pls reply w name email add detail contact us infoshangrilapropertiesinccom wwwshangrilapropertiesinccomrisemakati
co in makati needs software java developer knowledgeable in java in design development implementation of software applications can start asap kimphil28gmailcom,co makati needs software java developer knowledgeable java design development implementation software applications start asap,co makati need software java developer knowledgeable java design development implementation software application start asap
co in makati needs software java developer bachelors degree knowledgeable in java in design development implementation of software applications can start asap kimphil28gmailcom,co makati needs software java developer bachelors degree knowledgeable java design development implementation software applications start asap,co makati need software java developer bachelor degree knowledgeable java design development implementation software application start asap
co in makati needs software java developer bachelors degree knowledgeable in java in design development implementation of software applications kimphil28gmailcom,co makati needs software java developer bachelors degree knowledgeable java design development implementation software applications,co makati need software java developer bachelor degree knowledgeable java design development implementation software application
dine swim and get away for a day without having to leave the city at edsa shangrila manilas heat the sunday side for php2400net per person call 6338888,dine swim get away day without leave city edsa shangrila manilas heat sunday side per person call,dine swim get away day without leave city edsa shangrila manilas heat sunday side per person call
the last preselling lowrise condo in bgc is now available in special low dp 0 int terms experience low density living with private elevator access per unit that promises overwhelming views of forbes park and bgc skyline at the albany very rare find limited units await you choose from spacious 2br to 3br units with luxe finishing very prime preselling commercial lots at maple grove in gen trias cavite for sale for inquiries please contact andrew 63917689,last preselling lowrise condo bgc available special low dp int terms experience low density living private elevator access per unit promises overwhelming views forbes park bgc skyline albany rare find limited units await choose spacious units luxe finishing prime preselling commercial lots maple grove gen trias cavite sale inquiries please contact andrew,last preselle lowrise condo bgc available special low dp int term experience low density live private elevator access per unit promise overwhelming view forbe park bgc skyline albany rare find limited unit await choose spacious unit luxe finish prime preselling commercial lot maple grove gen trias cavite sale inquiry please contact andrew
now available instantly ageless effective and proven to erase eyebags and wrinkles in 2 minutes made in usa if interested to buy please reply,available instantly ageless effective proven erase eyebags wrinkles minutes made usa interested buy please reply,available instantly ageless effective prove erase eyebag wrinkles minute make usa interested buy please reply
shangrila updates risemakati oneofakind residential commercial development premier outstanding amenities prices start at 52m pls reply w your name email add for more details contact us infoshangrilapropertiesinccom wwwshangrilapropertiesinccomrisemakati,shangrila updates risemakati oneofakind residential commercial development premier outstanding amenities prices start m pls reply w name email add details contact us infoshangrilapropertiesinccom wwwshangrilapropertiesinccomrisemakati,shangrila update risemakati oneofakind residential commercial development premier outstanding amenity price start m pls reply w name email add detail contact us infoshangrilapropertiesinccom wwwshangrilapropertiesinccomrisemakati
resale office and condo units very much lower than market price ortigas makati moa area 25150 sqm available enjoy big discounts assume balance 0 interest sms for inquiries thank you,resale office condo units much lower market price ortigas makati moa area sqm available enjoy big discounts assume balance interest sms inquiries thank,resale office condo unit much low market price ortigas makati moa area sqm available enjoy big discount assume balance interest sm inquiry thank
introducing the latest 140hectare green city business district township development in the south the maple grove commercial lots are up for sale at this budding makatiinspired business district in general trias cavite only 20 minutes away from mall of asia and entertainment city via cavitex lots from 439 to 1750 sqm are available office buildings business hotels medical facilities etc may be built on these lots avail now at preselling prices and be one of the few owners of commercial lots at the future central business district this countrys biggest developers are developing for a presentation on the project please contact our sales manager ms beatrice at 63917998 megaworld corp,introducing latest green city business district township development south maple grove commercial lots sale budding makatiinspired business district general trias cavite minutes away mall asia entertainment city via cavitex lots sqm available office buildings business hotels medical facilities etc built lots avail preselling prices one owners commercial lots future central business district countrys biggest developers developing presentation project please contact sales manager ms beatrice megaworld corp,introduce late green city business district township development south maple grove commercial lot sale bud makatiinspire business district general trias cavite minute away mall asia entertainment city via cavitex lot sqm available office building business hotel medical facility etc build lot avail preselle price one owner commercial lot future central business district countrys big developer develop presentation project please contact sale manager ms beatrice megaworld corp
megaworlds newly launched preselling prime commercial lots maple grove is an integrated cbd township in the fast emerging gen tri cavite spanning 140 hectares curated cuts of 407 to 1000 sqm with option to combine extensive road network ready captive market easily accessible via daang hari cavitex calax and governors drive starts at only php 53ksqm first come first serve watch how progress unfolds for inquiries contact andrew at 63917689,megaworlds newly launched preselling prime commercial lots maple grove integrated cbd township fast emerging gen tri cavite spanning hectares curated cuts sqm option combine extensive road network ready captive market easily accessible via daang hari cavitex calax governors drive starts php first come first serve watch progress unfolds inquiries contact andrew,megaworlds newly launch preselle prime commercial lot maple grove integrate cbd township fast emerge gen tri cavite span hectare curate cut sqm option combine extensive road network ready captive market easily accessible via daang hari cavitex calax governor drive start php first come first serve watch progress unfold inquiry contact andrew
the biggest redevelopment along c5 in now ongoing 16 hectares mixused master planned community by ortigas company in synergy with ayala land neighboring wellknowned communities like valle verde will soon cater your needs the 1st residential tower within this community will soon be up for grabs be part of the this luxurious community at an affordable price for inquiries kindly reply with your name and email address,biggest redevelopment along ongoing hectares mixused master planned community ortigas company synergy ayala land neighboring wellknowned communities like valle verde soon cater needs residential tower within community soon grabs part luxurious community affordable price inquiries kindly reply name email address,big redevelopment along ongoing hectare mixuse master plan community ortigas company synergy ayala land neighbor wellknowned community like valle verde soon cater need residential tower within community soon grab part luxurious community affordable price inquiry kindly reply name email address
preselling office space for sale condotel for sale ortigas co projects in partnership w ayala 322 discount promo only 145165k per sqm only highend condo highend community new project w launch very soon in ortigas east tiendesitas 50b redevelopment plan sms email address for details,preselling office space sale condotel sale ortigas co projects partnership w ayala discount promo per sqm highend condo highend community new project w launch soon ortigas east tiendesitas redevelopment plan sms email address details,preselle office space sale condotel sale ortigas co project partnership w ayala discount promo per sqm highend condo highend community new project w launch soon ortigas east tiendesitas redevelopment plan sm email address detail
a modern ortigas p50b redevelopment of ortigas east formerly tiendesitas the greenbelt of c5 high end community like serendra bgc townhouse condo office for sale condotel hii developed by ortigas in partnership w ayala for details pls reply w your name email harry 63917188,modern ortigas redevelopment ortigas east formerly tiendesitas greenbelt high end community like serendra bgc townhouse condo office sale condotel hii developed ortigas partnership w ayala details pls reply w name email harry,modern ortigas redevelopment ortigas east formerly tiendesita greenbelt high end community like serendra bgc townhouse condo office sale condotel hii develop ortigas partnership w ayala detail pls reply w name email harry
are you into properties in bgc makati moa san juan binondo pasay area lease to own properties available in makati just reply with your name and email address for quotation many thanks,properties bgc makati moa san juan binondo pasay area lease properties available makati reply name email address quotation many thanks,property bgc makati moa san juan binondo pasay area lease property available makati reply name email address quotation many thank
pondopesoyou are granted p40000 credit on jan 9 complete your profile and apply get cash in 12 hours visit bitlygoogleplay_pondopeso optouttext no,pondopesoyou granted credit jan complete profile apply get cash hours visit optouttext,pondopesoyou grant credit jan complete profile apply get cash hour visit optouttext
the albany by megaworld will be the 1st condo in bgc that will be smart home equipped with only 64 units it truly separates itself amongst the elite in the area units boast of lighting control hvac motion sensor appliance control and security on top of existing rfid access from gate to elevator units and parking 2br 123 sqm p35m 3br 134 sqm p38m penthouse 349 sqm p99m maple grove commercial lots php 57ksqm only call andrew at 63917689,albany megaworld condo bgc smart home equipped units truly separates amongst elite area units boast lighting control hvac motion sensor appliance control security top existing rfid access gate elevator units parking sqm m sqm m penthouse sqm m maple grove commercial lots php call andrew,albany megaworld condo bgc smart home equip unit truly separate amongst elite area unit boast lighting control hvac motion sensor appliance control security top exist rfid access gate elevator unit park sqm m sqm m penthouse sqm m maple grove commercial lot php call andrew
lots available at the alabangwest village an exclusive subdivision across ayala alabang village and beside landers superstore alabang 1 506 sqm central location near the clubhouse 2 297 sqm perfect rectangular cut near the clubhouse 3 years installment without interest to know more about the development kindly send your email for a presentation or contact beatrice cortez at 63917998,lots available alabangwest village exclusive subdivision across ayala alabang village beside landers superstore alabang sqm central location near clubhouse sqm perfect rectangular cut near clubhouse years installment without interest know development kindly send email presentation contact beatrice cortez,lot available alabangw village exclusive subdivision across ayala alabang village beside landers superstore alabang sqm central location near clubhouse sqm perfect rectangular cut near clubhouse year installment without interest know development kindly send email presentation contact beatrice cortez
pesoloanyou are granted 8000 peso credit on mar 2 complete your file and apply get it in 12 hours no meetup visit bitlygoogleplay_09 optoutmsg no,pesoloanyou granted peso credit mar complete file apply get hours meetup visit optoutmsg,pesoloanyou grant peso credit mar complete file apply get hour meetup visit optoutmsg
upeso you are granted 12000 peso credit on mar 10 complete your file and apply get it in 12 hours visit bitlyupeso_googleplay optoutmsg no,upeso granted peso credit mar complete file apply get hours visit optoutmsg,upeso grant peso credit mar complete file apply get hour visit optoutmsg
condos for sale by shangrilaayala 2572sq in makati 81250sq in wack2ortigas resale units save up to 8m good for investmentrentalssellingend use w promoterms no dp this is the right time to invest reply with name email for more cmplte infos,condos sale shangrilaayala makati resale units save m good investmentrentalssellingend use w promoterms dp right time invest reply name email cmplte infos,condos sale shangrilaayala makati resale unit save m good investmentrentalssellingend use w promoterm dp right time invest reply name email cmplte infos
12000p waiting for you to apply in our app no meet up no guarantee click in google play bitlygoogleplay_50,waiting apply app meet guarantee click google play,waiting apply app meet guarantee click google play
lots available at the alabangwest village an exclusive subdivision across ayala alabang village and beside landers superstore alabang 1 506 sqm central location near the clubhouse 2 357 sqm near the main gate 3 years installment without interest to know more about the development kindly send your email for a presentation or contact trish cortez at 63917998,lots available alabangwest village exclusive subdivision across ayala alabang village beside landers superstore alabang sqm central location near clubhouse sqm near main gate years installment without interest know development kindly send email presentation contact trish cortez,lot available alabangw village exclusive subdivision across ayala alabang village beside landers superstore alabang sqm central location near clubhouse sqm near main gate year installment without interest know development kindly send email presentation contact trish cortez
the newest flagship condo along c5 maple at ortigas east 31sqm studio unit no dp promo 30 for 5 years at 0 interest only 30kmonth launch price location ortigas ave julia vargas cor c5 p60b remasterplan of tiendesitasfrontera verde a highend community like eastwood serendra bgc the greenbelt of c5 synergy of ortigas ayala sm for details pls reply with your nameemail or visit wwwatortigascom thank you 63917188,newest flagship condo along maple ortigas east studio unit dp promo years interest launch price location ortigas ave julia vargas cor remasterplan tiendesitasfrontera verde highend community like eastwood serendra bgc greenbelt synergy ortigas ayala sm details pls reply nameemail visit wwwatortigascom thank,new flagship condo along maple ortigas east studio unit dp promo year interest launch price location ortigas ave julia vargas cor remasterplan tiendesitasfrontera verde highend community like eastwood serendra bgc greenbelt synergy ortigas ayala sm detail pls reply nameemail visit wwwatortigascom thank
p12000 waiting for you to apply in our app no meet up no guarantee visit c7ggf9htz opt text stop phloan,waiting apply app meet guarantee visit opt text stop phloan,waiting apply app meet guarantee visit opt text stop phloan
p your account is granted p12000 on july 1 apply and get cash on the same day no guarantee no meetup visit c7ggfb2w9 phloan,p account granted july apply get cash day guarantee meetup visit phloan,p account grant july apply get cash day guarantee meetup visit phloan
need cash meron ka bang fully paid na car truck sangla your original orcr into cash wout taking a unit for as low as 1 mo calltxt larry 63910343,need cash meron bang fully paid car truck sangla original orcr cash wout taking unit low calltxt larry,need cash meron bang fully pay car truck sangla original orcr cash wout take unit low calltxt larry
be the first to live in capitol commons the royalton 103sqm 2br w parking 12 promo discount save and earn around p25m extended only until sep 30 only at 179ksqm the most affordable luxury condo in capitol commons 6 units a floor for details pls reply with your name email or visit us here wwwatortigascom thank you 63917188,first live capitol commons royalton w parking promo discount save earn around m extended sep affordable luxury condo capitol commons units floor details pls reply name email visit us wwwatortigascom thank,first live capitol commons royalton w parking promo discount save earn around m extend sep affordable luxury condo capitol commons unit floor detail pls reply name email visit we wwwatortigascom thank
be the first to live in capitol commons the royalton 103sqm 2br w parking 12 promo discount save and earn around p25m extended only until sep 30 only at 179ksqm the most affordable luxury condo in capitol commons 6 units a floor for details pls reply with your name email or visit us here wwwatortigascom thank you 63917188,first live capitol commons royalton w parking promo discount save earn around m extended sep affordable luxury condo capitol commons units floor details pls reply name email visit us wwwatortigascom thank,first live capitol commons royalton w parking promo discount save earn around m extend sep affordable luxury condo capitol commons unit floor detail pls reply name email visit we wwwatortigascom thank
good daythis is msnicole of security bank i just want to inform youthat you are qualified to avail our unsecured personal cash loanyou can loan 100k up to 5mdepending on your monthly incomeno collateralno hidden charges23 banking days processingplsreply yesyour name and your contact to expedite your loan thank you so much,good daythis msnicole security bank want inform youthat qualified avail unsecured personal cash loanyou loan monthly incomeno collateralno hidden banking days processingplsreply yesyour name contact expedite loan thank much,good daythis msnicole security bank want inform youthat qualified avail unsecured personal cash loanyou loan monthly incomeno collateralno hidden banking day processingplsreply yesyour name contact expedite loan thank much
hiring for german speakers in taguig document analyst w related exp shifting 7585k billing analyst w knowledge in sap billing suite is a plus midshift 6075k written spoken proficiency in the german english kimphil28gmailcom,hiring german speakers taguig document analyst w related exp shifting billing analyst w knowledge sap billing suite plus midshift written spoken proficiency german english,hire german speaker taguig document analyst w relate exp shift billing analyst w knowledge sap billing suite plus midshift write speak proficiency german english
hiring for german sheperds in taguig document analyst w related exp shifting 7585k billing analyst w knowledge in sap billing suite is a plus midshift 6075k written spoken proficiency in the german english kimphil28gmailcom,hiring german sheperds taguig document analyst w related exp shifting billing analyst w knowledge sap billing suite plus midshift written spoken proficiency german english,hire german sheperd taguig document analyst w relate exp shift billing analyst w knowledge sap billing suite plus midshift write speak proficiency german english
the rise makati along ayalaave bnew1br starts 58m by shangrila the only premium grade office tower for sale in ortigas cbd along adb ave 5units left for 58kmonth over 68mos w0 interest highend residential tower in ortigas center 2335k onlymo send nameemail for detailsmessage now,rise makati along ayalaave starts m shangrila premium grade office tower sale ortigas cbd along adb ave left interest highend residential tower ortigas center onlymo send nameemail detailsmessage,rise makati along ayalaave starts m shangrila premium grade office tower sale ortigas cbd along adb ave leave interest highend residential tower ortigas center onlymo send nameemail detailsmessage
808 12 12may 1228 p200 has been transferred from 63951723 to your mobile account ref290186706800,transferred mobile account,transfer mobile account
ihoiha nag ka mali ata ako ng pasa load sa iyo ko na ipasa ung 200 na load kung pwd paki blik naman ito yung number ng apo ko 63951723 gawin mo lng itext mo 63951723 200 isend mo sa 808 replayan mo ng yes ang susunod na mensahesalamat nak pasensya na sa abala pg palain ka sana,ihoiha nag mali ata pasa load ipasa ung load pwd paki blik naman yung number apo gawin lng itext isend replayan yes susunod mensahesalamat nak pasensya abala pg palain sana,ihoiha nag mali ata pasa load ipasa ung load pwd paki blik naman yung number apo gawin lng itext isend replayan yes susunod mensahesalamat nak pasensya abala pg palain sana
tropa parami na ng parami ang naglalaro at nanalo ng halos 6m na jackpot sa bingoplus bakit magpapahuli ka pa register na free ko na 40p mo,tropa parami parami naglalaro nanalo halos m jackpot bingoplus magpapahuli register free,tropa parami parami naglalaro nanalo halos m jackpot bingoplus magpapahuli register free
welcome your have p1222 for sot web 11ylife good luckc,welcome sot web good luckc,welcome sot web good luckc
my god at least 999p rewards waiting for you uri pinaswincom best baraha r,god least rewards waiting uri pinaswincom best baraha r,god least reward wait uri pinaswincom good baraha r
dear vip real name no 1 online sabong site here in sbet register now and play cockfighting and slot game machine you can claim your 100 free bet credit and win 88k cash prizes here in sbet7nowcomsabongnow,dear vip real name online sabong site sbet register play cockfighting slot game machine claim free bet credit win cash prizes,dear vip real name online sabong site sbet register play cockfighting slot game machine claim free bet credit win cash prize
real name today you can win the iphone14promax while earning a ton of cash prizes in w you can receive a 7777 signup bonus click now wp8luckcom8888win,real name today win earning ton cash prizes w receive signup bonus click,real name today win earn ton cash prize w receive signup bonus click
welcome your have p1222 for sot web greatslife good lucku,welcome sot web greatslife good lucku,welcome sot web greatslife good lucku
welcome your have p1222 for sot web willjlife good luckx,welcome sot web willjlife good luckx,welcome sot web willjlife good luckx
hottest news join jb day make it your day spin your luck here sign up now and get your golden egg and we have daily deposit bonus antiviruspedianetlive,hottest news join jb day make day spin luck sign get golden egg daily deposit bonus antiviruspedianetlive,hot news join jb day make day spin luck sign get golden egg daily deposit bonus antiviruspedianetlive
