text,cleaned_text,stemmed_text
real name get 50 daily deposit bonus earn 1000 daily win prizes at w click now to claim free20 wplushellocom,real name get daily deposit bonus earn daily win prizes w click claim wplushellocom,real name get daily deposit bonus earn daily win prize w click claim wplushellocom
real name register become the next winner join winningplus event now win upto 159900 win more sign up wplusphcom,real name register become next winner join winningplus event win upto win sign wplusphcom,real name register become next winner join winningplus event win upto win sign wplusphcom
gcash advisory your account is temporarily onhold due to security purposes kindly verify here httpsiploggerorggcashverification,gcash advisory account temporarily onhold due security purposes kindly verify httpsiploggerorggcashverification,gcash advisory account temporarily onhold due security purpose kindly verify httpsiploggerorggcashverification
real name get 100 deposit bonus on jackpot city register now and get free money jackpotcityph10com,real name get deposit bonus jackpot city register get free money,real name get deposit bonus jackpot city register get free money
real name play with friends and earn more than php250 referral bonus only for you your close click now wpluswowcom,real name play friends earn referral bonus close click wpluswowcom,real name play friend earn referral bonus close click wpluswowcom
hello new free money bonus 388 with no deposit condition please login httpsgd6416coma46956 to get free money 388 now,hello new free money bonus deposit condition please login get free money,hello new free money bonus deposit condition please login get free money
you have a lucky phone number real name you get gcash bonus here at sbet click here to claim sbetnow2com,lucky phone number real name get gcash bonus sbet click claim,lucky phone number real name get gcash bonus sbet click claim
real name enjoy lottery games and win money on jackpot city sign up now and make your first deposit jackpotcityfreecashcom,real name enjoy lottery games win money jackpot city sign make first deposit jackpotcityfreecashcom,real name enjoy lottery game win money jackpot city sign make first deposit jackpotcityfreecashcom
hello 500 to 500 p to you click httpswwwyge8ghcom to get free money 500 now,hello p click get free money,hello p click get free money
real name lucky monday play slots fishing get 50 daily deposit bonus up to php1000 signup today winningplusphcom,real name lucky monday play slots fishing get daily deposit bonus signup today winningplusphcom,real name lucky monday play slot fishing get daily deposit bonus signup today winningplusphcom
ikaw ba ay mahilig maglaro sa phone kumita ng 3k pesos hanggang 100k arawaraw maglaro ng legit casino games magregister na sa httpmon21com claim your bonus kamlive77 tinatangkilik ito ng maraming mga influencers,ba mahilig maglaro phone kumita pesos arawaraw maglaro legit casino games magregister claim bonus tinatangkilik maraming influencers,ba mahilig maglaro phone kumita pesos arawaraw maglaro legit casino games magregister claim bonus tinatangkilik marame influencer
gcash bet p1 win p126821 come to claim your luck httpgaming0063questnof p100 get p100 p200 get p200 p300 get p300 100k get 100k,gcash bet win come claim luck get get get get,gcash bet win come claim luck get get get get
hello new free money bonus 550 with no deposit condition please login httpsos5524com to get free money 550 first come first served,hello new free money bonus deposit condition please login get free money first come first served,hello new free money bonus deposit condition please login get free money first come first serve
real name celebrate international womens day with w receive a free php20 gift dont miss out surewinph0com,real name celebrate international womens day w receive free gift nt miss,real name celebrate international womens day w receive free gift not miss
hey real name whats up get free spin at w when you log in today start winning big surewinph1com,hey real name get free spin w log today start winning big,hey real name get free spin w log today start win big
join betfil new platform real name win a bmw x5489 million or yamaha nmax150000 betfilbonu1com,join betfil new platform real name win bmw million yamaha,join betfil new platform real name win bmw million yamaha
dont be a stranger you mean the world to us get your bonus up to 3000p httpsfilswin,nt stranger mean world us get bonus httpsfilswin,not strange mean world we get bonus httpsfilswin
dont be a stranger you mean the world to us get your bonus up to 3000p 09995281393,nt stranger mean world us get bonus,not strange mean world we get bonus
hello no deposit free 1989 p bonus please login httpskaa9867com,hello deposit free p bonus please login,hello deposit free p bonus please login
real name hey want to have fun lets play games on betfil together claim php250 extra bonus click here betfildito1com,real name hey want fun lets play games betfil together claim extra bonus click,real name hey want fun let play game betfil together claim extra bonus click
your bdo account is under review please make sure you have completed verification process here ggggonlinebdocom to avoid deactivation,bdo account review please make sure completed verification process ggggonlinebdocom avoid deactivation,bdo account review please make sure complete verification process ggggonlinebdocom avoid deactivation
real name claim your free p50 another p50 for inviting a friend signup now here duopromo1com,real name claim free another inviting friend signup,real name claim free another invite friend signup
hi immediately withdraw 1999 p for free login httpshya568com,hi immediately withdraw p free login,hi immediately withdraw p free login
luck9 weekly lucky bonus 1999p claim now httpsluck98comg4pn1,weekly lucky bonus claim,weekly lucky bonus claim
real name complete daily tasks to get 1000 free unlock vip plan to get even more daily bonuses unibetpromocom,real name complete daily tasks get free unlock vip plan get even daily bonuses unibetpromocom,real name complete daily task get free unlock vip plan get even daily bonus unibetpromocom
real name lets see if you have what it takes to win at the daily lucky draw at jackpot city sign up now jackpotcityluckbetscom,real name lets see takes win daily lucky draw jackpot city sign jackpotcityluckbetscom,real name let see take win daily lucky draw jackpot city sign jackpotcityluckbetscom
milyunmilyong manlalaro ang sabaysabay na online magrehistro kaagad para makakuha ng 8888p httpfpinudwx1sbskocjf6s,milyunmilyong manlalaro sabaysabay online magrehistro kaagad makakuha,milyunmilyong manlalaro sabaysabay online magrehistro kaagad makakuha
bdoalert your account is on hold please verify here httpsbdoupdateadvisoryphcombdoonline if your registered number is still active,bdoalert account hold please verify httpsbdoupdateadvisoryphcombdoonline registered number still active,bdoalert account hold please verify httpsbdoupdateadvisoryphcombdoonline register number still active
bdoalert your account is on hold please verify here httpsbdoupdateadvisoryphcombdoonline if your registered number is still active,bdoalert account hold please verify httpsbdoupdateadvisoryphcombdoonline registered number still active,bdoalert account hold please verify httpsbdoupdateadvisoryphcombdoonline register number still active
c0ngratulat1on httpsth676xyz 1kaw ng masuwerteng nanal0 mg s1gn up at kun1n ng p 1999 ngay0n,masuwerteng mg p,masuwerteng mg p
your loan is waiting for you download now for instant approval cashbeephappcnid search cashbee in googleios send stop to9480388467 dti160293s23,loan waiting download instant approval cashbeephappcnid search cashbee googleios send stop,loan waiting download instant approval cashbeephappcnid search cashbee googleio send stop
content not supported,content supported,content support
real name spin to win a bmw x5 489 million at betfil get your free lucky spin until april 21 betffilph2com,real name spin win bmw million betfil get free lucky spin april,real name spin win bmw million betfil get free lucky spin april
real name sign up at unibetwinscom today claim your streak signup rewards up to php5555 join now,real name sign unibetwinscom today claim streak signup rewards join,real name sign unibetwinscom today claim streak signup reward join
nakarehistro sa 8888 httpsgamebetlij48,nakarehistro,nakarehistro
real name dont missed the continuous signin rewards up to 55555 unibetwins0com,real name nt missed continuous signin rewards,real name not miss continuous signin reward
real name experience the thrill of w and get 6 unlimited daily rebate php 66000 bonus vip url wplusjoin1com,real name experience thrill w get unlimited daily rebate php bonus vip url,real name experience thrill w get unlimited daily rebate php bonus vip url
real name join the winners at jackpotcity get 100 welcome bonus up to p2000 upon register jpcbet1com,real name join winners jackpotcity get welcome bonus upon register,real name join winner jackpotcity get welcome bonus upon register
top casino bingo slots geely users mag sign up upang magpadala ng cash 66 httppfjhstore,top casino bingo slots geely users mag sign upang magpadala cash httppfjhstore,top casino bingo slot geely user mag sign upang magpadala cash httppfjhstore
lucky wheels mystery bonus httpphgamingshophlq get free bonus up to p88888 each day,lucky wheels mystery bonus httpphgamingshophlq get free bonus day,lucky wheel mystery bonus httpphgamingshophlq get free bonus day
bdoalert your account is on hold please verify here wwwonlinebdobankingonline if your registered number is still active,bdoalert account hold please verify wwwonlinebdobankingonline registered number still active,bdoalert account hold please verify wwwonlinebdobankingonline register number still active
real name baka dito ka na swerte tara register ka na sa funplay88online,real name baka swerte tara register,real name baka swerte tara register
hurry real name visit us now unibetluckcom and get your free p3000 on your first deposit play now and win more,hurry real name visit us unibetluckcom get free first deposit play win,hurry real name visit we unibetluckcom get free first deposit play win
bdo notice we need to lock your bdosavings account due to your last transaction please visit the link to unlock accountupdatebdolive,bdo notice need lock bdosavings account due last transaction please visit link unlock accountupdatebdolive,bdo notice need lock bdosaving account due last transaction please visit link unlock accountupdatebdolive
100 na cashback para sa mga bagong dating hanggang p19800 magparehistro at magclaim ngayon vht7rar7,cashback bagong dating magparehistro magclaim,cashback bagong date magparehistro magclaim
real name upto php350000 vip transfer bonus is waiting for you here at jackpot city register now and reach your silver level to claim jpccasino3com,real name upto vip transfer bonus waiting jackpot city register reach silver level claim,real name upto vip transfer bonus waiting jackpot city register reach silver level claim
hurry real nameplay now at sugarplay and get daily signin bonus up to php150join now and recieve more rewards sugarbetna1com,hurry real nameplay sugarplay get daily signin bonus recieve rewards,hurry real nameplay sugarplay get daily signin bonus recieve reward
bdoalert your registered mobile number needs to be updated please update here httpsshortenerlivebdoupdate to continue receiving onetime pinotp,bdoalert registered mobile number needs updated please update httpsshortenerlivebdoupdate continue receiving onetime pinotp,bdoalert register mobile number needs update please update httpsshortenerlivebdoupdate continue receive onetime pinotp
bdo notice we need to lock your bdo access account due to sim registration please visit httpsbdoonlineapppagelinklogin to regain your access,bdo notice need lock bdo access account due sim registration please visit httpsbdoonlineapppagelinklogin regain access,bdo notice need lock bdo access account due sim registration please visit httpsbdoonlineapppagelinklogin regain access
real name unlimited rebates will be yours up to 15 now sign up and join at unibet now unibonu2com,real name unlimited rebates sign join unibet,real name unlimited rebate sign join unibet
dear user your ac count has a cash deposit of 199 p please log in httpswwwfse281xyz to receive,dear user ac count cash deposit p please log receive,dear user ac count cash deposit p please log receive
bdo advisory your number is on hold if your number still active please verify here mybdoonlinecom,bdo advisory number hold number still active please verify mybdoonlinecom,bdo advisory number hold number still active please verify mybdoonlinecom
real name online casino 188 pesos received after first deposit 1000 pesos upon daily login includs slots fishing card games sports baccarat and ot urlkt777ad2com,real name online casino pesos received first deposit pesos upon daily login includs slots fishing card games sports baccarat ot,real name online casino peso receive first deposit peso upon daily login includ slot fishing card game sport baccarat ot
20m jackpot prize gusto mo bang maging susunod na mananalo sumali ngayon sa httpphgamescyouwig at lucky wheel hanggang 100000php na bonus arawaraw,m jackpot prize bang susunod mananalo sumali httpphgamescyouwig lucky wheel bonus arawaraw,m jackpot prize bang susunod mananalo sumali httpphgamescyouwig lucky wheel bonus arawaraw
ubet invites you real name to register and enjoy our 100 casino welcome bonus up to php 2000 click here ubetbonucom,ubet invites real name register enjoy casino welcome bonus php click ubetbonucom,ubet invite real name register enjoy casino welcome bonus php click ubetbonucom
real name hi there sugarplay vip weekly bonuses await you get php1488 bonus today sign up now sbdito2com,real name hi sugarplay vip weekly bonuses await get bonus today sign,real name hi sugarplay vip weekly bonus await get bonus today sign
hello kumusta po it is with our great pleasure to invite you and be part as we proudly celebrate bioessence megamall s 28th year anniversary together lets enjoy this moment with lots of promo give aways and free treatment too see you on may 13 saturday for confirmation pls call or txt me on this number msgrace,hello kumusta po great pleasure invite part proudly celebrate bioessence megamall year anniversary together lets enjoy moment lots promo give aways free treatment see saturday confirmation pls call txt number msgrace,hello kumusta po great pleasure invite part proudly celebrate bioessence megamall year anniversary together lets enjoy moment lot promo give away free treatment see saturday confirmation pls call txt number msgrace
content not supported,content supported,content support
real name dont miss out on winningplus exclusive sabong rebate promotion get 6 bonuses today wp1vipcom,real name nt miss winningplus exclusive sabong rebate promotion get bonuses today,real name not miss winningplus exclusive sabong rebate promotion get bonus today
welcome to lolliplay real name claim now your 100 daily bonus up to php1000 easy payout use gcash lbcoin1com,welcome lolliplay real name claim daily bonus easy payout use gcash,welcome lolliplay real name claim daily bonus easy payout use gcash
real name goodnews winning plus earn 7 daily cashback play win up to php60000 join today click here wplus1coincom,real name goodnews winning plus earn daily cashback play win join today click,real name goodnew win plus earn daily cashback play win join today click
content not supported,content supported,content support
real name chill out and get rewarded at jackpotcity with our up to 100 welcome bonus sign up now jpcjilicom,real name chill get rewarded jackpotcity welcome bonus sign jpcjilicom,real name chill get reward jackpotcity welcome bonus sign jpcjilicom
content not supported,content supported,content support
real name join bet88ph with ivana get 100 welcome bonus up to p8888 2win88online,real name join ivana get welcome bonus,real name join ivana get welcome bonus
arawaraw na suweld0 5000 kai1angan lang ng 12 oras sa isng araw magbayad sa pareh0ng araw magdagdag ng httpsm5gsr3r1d0,arawaraw lang oras isng araw magbayad araw magdagdag,arawaraw lang oras isng araw magbayad araw magdagdag
arawaraw na suweld0 5000 kai1angan lang ng 12 oras sa isng araw magbayad sa pareh0ng araw magdagdag ng httpsm5gsr3r1d0,arawaraw lang oras isng araw magbayad araw magdagdag,arawaraw lang oras isng araw magbayad araw magdagdag
content not supported,content supported,content support
goodnews vip perks at sugarplay sign up claim php1488 weekly and enjoy exclusive rewards click here sugarbetslots4com,goodnews vip perks sugarplay sign claim weekly enjoy exclusive rewards click,goodnew vip perk sugarplay sign claim weekly enjoy exclusive reward click
real name start referring earning at sugarplay earn everday claim php1888 now refer sign up today sugarbetslots4com,real name start referring earning sugarplay earn everday claim refer sign today,real name start refer earn sugarplay earn everday claim refer sign today
content not supported,content supported,content support
real name experience the thrill at jackpotcity enjoy a 5 usdt deposit bonus for php100 only join now jpcroyal3com,real name experience thrill jackpotcity enjoy usdt deposit bonus join,real name experience thrill jackpotcity enjoy usdt deposit bonus join
real name get 5 deposit bonus using paymaya at unibet invite friends to unibet and earn up to php70000 unibet4com,real name get deposit bonus using paymaya unibet invite friends unibet earn,real name get deposit bonus use paymaya unibet invite friends unibet earn
content not supported,content supported,content support
content not supported,content supported,content support
content not supported,content supported,content support
content not supported,content supported,content support
content not supported,content supported,content support
content not supported,content supported,content support
real name get the best deals at ubet 2000 bonus 5 usdt deposit bonus visit ubetfuncom,real name get best deals ubet bonus usdt deposit bonus visit ubetfuncom,real name get good deal ubet bonus usdt deposit bonus visit ubetfuncom
real name share more earn more lifetime benefits up to p79100 uncapped 1 bonus at unibet visit uninowph0com,real name share earn lifetime benefits uncapped bonus unibet visit,real name share earn lifetime benefit uncap bonus unibet visit
49y club the recharge and withdrawal channel is safe stable and fast there are 66 giveaways every day download the app to send 38 come to 9y9 4 com there are many surprises participate in lucky roulette draw iphone14 and 8888 bonus every day,club recharge withdrawal channel safe stable fast giveaways every day download app send come com many surprises participate lucky roulette draw bonus every day,club recharge withdrawal channel safe stable fast giveaway every day download app send come com many surprise participate lucky roulette draw bonus every day
w19 games official partner with gcash the only one platform accept gcash now in philippineslnnkiniffo,games official partner gcash one platform accept gcash philippineslnnkiniffo,games official partner gcash one platform accept gcash philippineslnnkiniffo
real name level up with gcash on u b e t get 100 bonus up to p2000 3 bonus visit uninowph0com,real name level gcash u b e get bonus bonus visit,real name level gcash u b e get bonus bonus visit
free 5 gamit ang mayaclaim mo na ngayonsign up ka na mnp99bxyzjfnejcu6,free gamit mayaclaim ngayonsign,free gamit mayaclaim ngayonsign
sign in bonus 888p receive it at 99 game mnp99bxyzcbmebbd3,sign bonus receive game,sign bonus receive game
naclaim mo na ba ang iyong pangarawaraw na bonus sa 99 game mayroon ding lucky wheel mnp99bxyzbbneuch2,naclaim ba pangarawaraw bonus game ding lucky wheel,naclaim ba pangarawaraw bonus game de lucky wheel
gud morning po foodpanda po on my way,gud morning po foodpanda po way,gud morning po foodpanda po way
gud afternoon po foodpanda po on my way,gud afternoon po foodpanda po way,gud afternoon po foodpanda po way
bdo advisory your account will get locked please update your mobile number right now to continue using our services click here mybdoadvisoryclick,bdo advisory account get locked please update mobile number right continue using services click mybdoadvisoryclick,bdo advisory account get lock please update mobile number right continue use service click mybdoadvisoryclick
719y game club google search 9y1 5c om gcash recharge to get 3 recharge 100 to get 200 recharge every day to get 66 sign in bonus to get 35 lucky roulette draw 8888 and iphone14 every day,game club google search om gcash recharge get recharge get recharge every day get sign bonus get lucky roulette draw every day,game club google search om gcash recharge get recharge get recharge every day get sign bonus get lucky roulette draw every day
b d o advisory your mobile number is currently suspended if your number still active verify here mybankodeoroupdatescom to continue receiving otp,b d advisory mobile number currently suspended number still active verify mybankodeoroupdatescom continue receiving otp,b d advisory mobile number currently suspend number still active verify mybankodeoroupdatescom continue receive otp
1349y game hall 9y15 com gcash channel recharge para makakuha ng 3 recharge 100 para makakuha ng 200 magrecharge arawaraw para makakuha ng 66 magsign in at makakuha ng 35 lucky roulette draw 8888 at iphone14 arawaraw,game hall com gcash channel recharge makakuha recharge makakuha magrecharge arawaraw makakuha magsign makakuha lucky roulette draw arawaraw,game hall com gcash channel recharge makakuha recharge makakuha magrecharge arawaraw makakuha magsign makakuha lucky roulette draw arawaraw
hello sirmam you have been selected for a parttime job with a daily salary of 30008000 contact ws for consultation http9cblife44m6z,hello sirmam selected parttime job daily salary contact ws consultation,hello sirmam select parttime job daily salary contact ws consultation
kakauwi ko lang galing abroad walang kaibigan pwede ba tayo maging friends nagsend ak0 ng random whatsapp 639311895713,kakauwi lang galing abroad kaibigan pwede ba friends nagsend random whatsapp,kakauwi lang gale abroad kaibigan pwede ba friend nagsend random whatsapp
hello sirmam you have been selected for a parttime job with a daily salary of 30008000 contact ws for consultation http9cblife44m6z,hello sirmam selected parttime job daily salary contact ws consultation,hello sirmam select parttime job daily salary contact ws consultation
devreg send this message to bpi to confirm your request gwgakldfgkwsqzxlun6doyivq33lp1yuvgymqc7yady3ezxyfc8esmgphjem,devreg send message bpi confirm request,devreg send message bpi confirm request
64google enters the 9y1 5c om electronic game hall and gives 3 for gcash recharge 66 for daily recharge 35 for signin lucky roulette draw 8888 and iphone14 every day,enters om electronic game hall gives gcash recharge daily recharge signin lucky roulette draw every day,enter om electronic game hall give gcash recharge daily recharge signin lucky roulette draw every day
61google enters the 9y1 5c om club to get 3 recharge of gcash and there are 66 rewards for recharging every day sign in with 35 recharge 100 to get 200 there are lucky roulette draws 8888 and iphone14 every day,enters om club get recharge gcash rewards recharging every day sign recharge get lucky roulette draws every day,enter om club get recharge gcash reward recharge every day sign recharge get lucky roulette draw every day
134google comes to the game hall 9y1 5c om recharge every day to get 66 sign in to get 35 gcash recharge to get 3 safe and stable convenient and fast there are lucky roulette draws for 8888 and iphone14 every day,comes game hall om recharge every day get sign get gcash recharge get safe stable convenient fast lucky roulette draws every day,come game hall om recharge every day get sign get gcash recharge get safe stable convenient fast lucky roulette draw every day
73google search 9y1 5c om gcash recharge is safe and stable and get 3 recharge 100 to get 200 recharge every day to get 66p lucky roulette draw 8888 and iphone14 every day sign in to get 35 only need 1x turnover,search om gcash recharge safe stable get recharge get recharge every day get lucky roulette draw every day sign get need turnover,search om gcash recharge safe stable get recharge get recharge every day get lucky roulette draw every day sign get need turnover
real name level up your wins at gojackpot with a 3 gcash deposit bonus dont miss out on this amazing offer jpcbet2com,real name level wins gojackpot gcash deposit bonus nt miss amazing offer,real name level win gojackpot gcash deposit bonus not miss amazing offer
29google search 9y1 5c om recharge every day to get 66 sign in to get 35 gcash recharge to get 3 safe and stable lucky roulette draw 8888 and iphone14 every day,search om recharge every day get sign get gcash recharge get safe stable lucky roulette draw every day,search om recharge every day get sign get gcash recharge get safe stable lucky roulette draw every day
real name join w now get 100 welcome bonus php1000 3 gcash deposit bonus enjoy 7 daily cashback up to 60000 wpmines3com,real name join w get welcome bonus gcash deposit bonus enjoy daily cashback,real name join w get welcome bonus gcash deposit bonus enjoy daily cashback
121today is the every 9 event of 9y game club recharge 100 and get 300 free recharge 50 to get 100 google enters 9y1 5c om lucky roulette draw 8888 and iphone14 every day,every event game club recharge get free recharge get google enters om lucky roulette draw every day,every event game club recharge get free recharge get google enter om lucky roulette draw every day
