text,ctext,stopwords_removed,cleaned_text,language
"iho/iha nag ka mali ata ako ng pasa load. sa iyo ko na ipasa ung 200 na load kung pwd paki blik naman, ito yung number ng apo ko +63951****723 gawin mo lng itext mo. +63951****723 200 isend mo sa 808. replayan mo ng YES ang susunod na mensahe.Salamat nak pasensya na sa abala, pg palain ka sana","iho/iha nag ka mali ata ako ng pasa load. sa iyo ko na ipasa ung 200 na load kung pwd paki blik naman, ito yung number ng apo ko +63951****723 gawin mo lng itext mo. +63951****723 200 isend mo sa 808. replayan mo ng YES ang susunod na mensahe.Salamat nak pasensya na sa abala, pg palain ka sana",iho iha nag mali ata pasa load ipasa ung load pwd paki blik naman yung number apo gawin lng itext isend replayan yes susunod mensahe salamat nak pasensya abala pg palain sana,iho iha nag mali ata pasa load ipasa ung pwd paki blik naman yung number apo gawin lng itext yes susunod mensahe salamat nak pasensya abala pg sana,tagalog
"Tropa! Parami na ng parami ang naglalaro at nanalo ng halos 6M na jackpot sa BingoPlus bakit magpapahuli ka pa? Register na, FREE ko na 40P mo.","Tropa! Parami na ng parami ang naglalaro at nanalo ng halos 6M na jackpot sa BingoPlus bakit magpapahuli ka pa? Register na, FREE ko na 40P mo.",tropa parami parami naglalaro nanalo halos m jackpot bingoplus magpapahuli register free,tropa parami naglalaro nanalo halos m jackpot magpapahuli register free,tagalog
"Sugal hindi na need pumunta CAS1NO, pIay online at manalo araw araw, upto 8888 na welcome bonus, 24 hours cash in/out.
Web: win-m.life","Sugal hindi na need pumunta CAS1NO, pIay online at manalo araw araw, upto 8888 na welcome bonus, 24 hours cash in/out. Web: win-m.life",sugal need piay online manalo araw araw upto welcome bonus hours cash web,sugal need online manalo araw welcome bonus hours cash web,tagalog
Wag na masyadong mapakapagod dahil friday na! Isa sa pinaka the BE$T na gawin mamaya ay ang mag Enjoy dito! apkgametop.com/LivePH See you later my friend!,Wag na masyadong mapakapagod dahil friday na! Isa sa pinaka the BE$T na gawin mamaya ay ang mag Enjoy dito! apkgametop.com/LivePH See you later my friend!,wag masyadong mapakapagod friday pinaka gawin mamaya enjoy see later friend,wag masyadong friday pinaka gawin mamaya enjoy see later friend,tagalog
"Napaka ganda ng pasok ng Weekend! Dahil dito kay antiviruspedia.net/Live napaka daming B0nu$ naghihintay sayo, hindi lang yan dahil chance mo pang maging VIP!","Napaka ganda ng pasok ng Weekend! Dahil dito kay antiviruspedia.net/Live napaka daming B0nu$ naghihintay sayo, hindi lang yan dahil chance mo pang maging VIP!",ganda pasok weekend kay daming naghihintay sayo lang yan chance pang vip,ganda pasok weekend kay daming naghihintay sayo lang yan chance pang vip,tagalog
Maglaro na at kolektahin ang mga Promotion Bonus na naghihintay sayo at ang mega jackpot x10 - x100 B3T! halina't mag laro ngayon dito! apkgametop.com/LivePH,Maglaro na at kolektahin ang mga Promotion Bonus na naghihintay sayo at ang mega jackpot x10 - x100 B3T! halina't mag laro ngayon dito! apkgametop.com/LivePH,maglaro kolektahin promotion bonus naghihintay sayo mega jackpot laro,maglaro kolektahin promotion bonus naghihintay sayo mega jackpot laro,tagalog
"Sugal hindi na need pumunta CAS1NO, pIay online at manalo araw araw, upto 8888 na welcome bonus, 24 hours cash in/out.
Web: game-j.life","Sugal hindi na need pumunta CAS1NO, pIay online at manalo araw araw, upto 8888 na welcome bonus, 24 hours cash in/out. Web: game-j.life",sugal need piay online manalo araw araw upto welcome bonus hours cash web,sugal need online manalo araw welcome bonus hours cash web,tagalog
This is your LucKy day! DAhil JB Day ngayon! Mag $pin at makakuha ng maraming PRIZES! Wag mag alinlangan siguradong bubuhos ng swerte! antiviruspedia.net/Live,This is your LucKy day! DAhil JB Day ngayon! Mag $pin at makakuha ng maraming PRIZES! Wag mag alinlangan siguradong bubuhos ng swerte! antiviruspedia.net/Live,lucky day jb day pin makakuha maraming prizes wag alinlangan siguradong bubuhos swerte,lucky day jb pin makakuha maraming prizes wag alinlangan siguradong bubuhos swerte,tagalog
Wag ng tumingin pa sa iba. Dahil ang hinahanap m0 at hinahanap ng iba ay nandit0 lang kay playbingo.com.ph/LegitAPP subukan m0 na walang mawawala sayo,Wag ng tumingin pa sa iba. Dahil ang hinahanap m0 at hinahanap ng iba ay nandit0 lang kay playbingo.com.ph/LegitAPP subukan m0 na walang mawawala sayo,wag tumingin hinahanap hinahanap lang kay subukan mawawala sayo,wag tumingin hinahanap lang kay subukan mawawala sayo,tagalog
This is your LucKy day! DAhil JB Day ngayon! Mag $pin at makakuha ng maraming PRIZES! Wag mag alinlangan siguradong bubuhos ng swerte! barbadostelecom.com/Live,This is your LucKy day! DAhil JB Day ngayon! Mag $pin at makakuha ng maraming PRIZES! Wag mag alinlangan siguradong bubuhos ng swerte! barbadostelecom.com/Live,lucky day jb day pin makakuha maraming prizes wag alinlangan siguradong bubuhos swerte,lucky day jb pin makakuha maraming prizes wag alinlangan siguradong bubuhos swerte,tagalog
"Ang Smart ay nagiimbita para kunin ang inyong 1,888 bonus. Ito ay matatanggap sa inyOng Acc0unt. URL: ww3467.pw/3tZBIuD","Ang Smart ay nagiimbita para kunin ang inyong 1,888 bonus. Ito ay matatanggap sa inyOng Acc0unt. URL: ww3467.pw/3tZBIuD",smart nagiimbita kunin bonus matatanggap url,smart kunin bonus matatanggap,tagalog
"Ang Smart ay nagiimbita para kunin ang inyong 1,888 bonus. Ito ay matatanggap sa inyOng Acc0unt. URL: ww3467.pw/3U9RA8v","Ang Smart ay nagiimbita para kunin ang inyong 1,888 bonus. Ito ay matatanggap sa inyOng Acc0unt. URL: ww3467.pw/3U9RA8v",smart nagiimbita kunin bonus matatanggap url,smart kunin bonus matatanggap,tagalog
"ESugal hindi na need pumunta CASlNO, pIay online at manalo araw araw, upto 8888 na welcome B0NUS.
Web: pinas-b.life","ESugal hindi na need pumunta CASlNO, pIay online at manalo araw araw, upto 8888 na welcome B0NUS. Web: pinas-b.life",esugal need caslno piay online manalo araw araw upto welcome web,need online manalo araw welcome web,tagalog
"10,000 USDT for participating in the Experience Trading Sharing Contest!https://t.co/cyhM4iQRdg","10,000 USDT for participating in the Experience Trading Sharing Contest!https://t.co/cyhM4iQRdg",usdt participating experience trading sharing,participating experience trading sharing,tagalog
M0nday na! Bigyan natin ng suwerte ang araw mo ngayon! Dahil dito kay bartargame.com/Live may Daily B0nu$ at chance mo pa mag T0P 1! Pinipilahan ng lahat!,M0nday na! Bigyan natin ng suwerte ang araw mo ngayon! Dahil dito kay bartargame.com/Live may Daily B0nu$ at chance mo pa mag T0P 1! Pinipilahan ng lahat!,bigyan natin suwerte araw kay daily chance pinipilahan,bigyan natin suwerte araw kay daily chance pinipilahan,tagalog
"Bagong balita! Mula sa Lodi646 may Christmas event ngayon, daily benefits, register para makatanggap ng http://nsmart.pro","Bagong balita! Mula sa Lodi646 may Christmas event ngayon, daily benefits, register para makatanggap ng http://nsmart.pro",bagong balita christmas event daily benefits register makatanggap,bagong balita christmas event daily benefits register makatanggap,tagalog
Happy Monday Lodi! Lunes na at 5 days nalang pasko na! Maraming handog na pamasko ang breakingnewsmanila.com/Game sayo! Ayain ang barkada at mag register na!,Happy Monday Lodi! Lunes na at 5 days nalang pasko na! Maraming handog na pamasko ang breakingnewsmanila.com/Game sayo! Ayain ang barkada at mag register na!,happy monday lodi lunes days nalang pasko maraming handog pamasko sayo ayain barkada register,happy monday lunes days nalang pasko maraming handog pamasko sayo ayain barkada register,tagalog
Halika at tumanggap ng 50MBG spree nang libre!.Google play or APP store search for mybitglobal to download apps,Halika at tumanggap ng 50MBG spree nang libre!.Google play or APP store search for mybitglobal to download apps,halika tumanggap spree nang play app store search mybitglobal download apps,halika tumanggap spree nang play store search download apps,tagalog
"jackpot! Ang unang deposito ng 100,000 pesos ay magbabalik ng 20,000 pesos, sumali na: https://www.777pub.pub/?agentid=10007604","jackpot! Ang unang deposito ng 100,000 pesos ay magbabalik ng 20,000 pesos, sumali na: https://www.777pub.pub/?agentid=10007604",jackpot unang deposito pesos magbabalik pesos sumali,jackpot unang deposito pesos magbabalik sumali,tagalog
"<REAL NAME>, Dito wala kang talo! Maglaro na at manalo ng iPhone 14PRO MAX at 80,000P o higit pa

Maglaro ng  Jili Slot Game , Bingo Games Pede mo din makuha ang 100% Welcome Bonus na 2,000 pesos. Maglaro na ! jackpotcity20bonus.com ","<REAL NAME>, Dito wala kang talo! Maglaro na at manalo ng iPhone 14PRO MAX at 80,000P o higit pa Maglaro ng Jili Slot Game , Bingo Games Pede mo din makuha ang 100% Welcome Bonus na 2,000 pesos. Maglaro na ! jackpotcity20bonus.com",real name wala kang talo maglaro manalo iphone max higit maglaro jili slot game bingo games pede makuha welcome bonus pesos maglaro,real name wala kang talo maglaro manalo iphone max higit slot game bingo games makuha welcome bonus pesos,tagalog
"ikaw ba ay mahilig maglaro sa phone? Kumita ng 3K PESOS hanggang 100K ARAW-ARAW!
Maglaro ng Legit Casino Games! Mag-register na sa ""http://mon21.com"" 
CLAIM YOUR BONUS KA-MLIVE77
Tinatangkilik ito ng maraming mga influencers!","ikaw ba ay mahilig maglaro sa phone? Kumita ng 3K PESOS hanggang 100K ARAW-ARAW! Maglaro ng Legit Casino Games! Mag-register na sa ""http://mon21.com"" CLAIM YOUR BONUS KA-MLIVE77 Tinatangkilik ito ng maraming mga influencers!",ba mahilig maglaro phone kumita k pesos k araw araw maglaro legit casino games register claim bonus tinatangkilik maraming influencers,ba mahilig maglaro phone kumita k pesos araw legit casino games register claim bonus tinatangkilik maraming,tagalog
"Milyun-milyong manlalaro ang sabay-sabay na online, magrehistro kaagad para makakuha ng 8-888P http://fpin.u.dwx1.sbs/kOCJf6s","Milyun-milyong manlalaro ang sabay-sabay na online, magrehistro kaagad para makakuha ng 8-888P http://fpin.u.dwx1.sbs/kOCJf6s",milyun milyong manlalaro sabay sabay online magrehistro kaagad makakuha,milyong manlalaro sabay online magrehistro kaagad makakuha,tagalog
C0ngratulat1on  https://th676.xyz  1kaw @ng masuwerteng nanal0 m@g s1gn up at kun1n @ng P 1999 ngay0n,C0ngratulat1on https://th676.xyz 1kaw @ng masuwerteng nanal0 m@g s1gn up at kun1n @ng P 1999 ngay0n,masuwerteng p,masuwerteng p,tagalog
Nakarehistro sa 8888  https://gamebet.li/j48,Nakarehistro sa 8888 https://gamebet.li/j48,nakarehistro,nakarehistro,tagalog
"100% na cashback para sa mga bagong dating, hanggang P19800! Magparehistro at mag-claim ngayon!
v.ht/7Rar7","100% na cashback para sa mga bagong dating, hanggang P19800! Magparehistro at mag-claim ngayon! v.ht/7Rar7",cashback bagong dating magparehistro claim,bagong dating magparehistro claim,tagalog
"20M+ Jackpot Prize! Gusto mo bang maging susunod na mananalo? Sumali ngayon sa http://phgames.cyou/WIg at Lucky Wheel: hanggang 100,000PHP na bonus araw-araw!","20M+ Jackpot Prize! Gusto mo bang maging susunod na mananalo? Sumali ngayon sa http://phgames.cyou/WIg at Lucky Wheel: hanggang 100,000PHP na bonus araw-araw!",jackpot prize bang susunod mananalo sumali lucky wheel bonus araw araw,jackpot prize bang susunod mananalo sumali lucky wheel bonus araw,tagalog
"Araw-araw na suweld0 5000, kai1angan lang ng 1-2 oras sa is@ng araw, magbayad sa pareh0ng araw, magdagdag ng  https://m5.gs/R3R1d0","Araw-araw na suweld0 5000, kai1angan lang ng 1-2 oras sa is@ng araw, magbayad sa pareh0ng araw, magdagdag ng https://m5.gs/R3R1d0",araw araw lang oras araw magbayad araw magdagdag,araw lang oras magbayad magdagdag,tagalog
"Araw-araw na suweld0 5000, kai1angan lang ng 1-2 oras sa is@ng araw, magbayad sa pareh0ng araw, magdagdag ng  https://m5.gs/R3R1d0","Araw-araw na suweld0 5000, kai1angan lang ng 1-2 oras sa is@ng araw, magbayad sa pareh0ng araw, magdagdag ng https://m5.gs/R3R1d0",araw araw lang oras araw magbayad araw magdagdag,araw lang oras magbayad magdagdag,tagalog
FREE 5% gamit ang MAYA?Claim mo na ngayon!Sign up ka na mn.p99b.xyz/jfnejcu6,FREE 5% gamit ang MAYA?Claim mo na ngayon!Sign up ka na mn.p99b.xyz/jfnejcu6,free gamit,free gamit,tagalog
"Kakauwi ko lang galing abroad, walang kaibigan. Pwede ba tayo maging friends? Nag-send ak0 ng random. 
What''sapp +639311895713","Kakauwi ko lang galing abroad, walang kaibigan. Pwede ba tayo maging friends? Nag-send ak0 ng random. What''sapp +639311895713",kakauwi lang galing abroad kaibigan pwede ba friends nag send random,kakauwi lang galing abroad kaibigan pwede ba friends nag send random,tagalog
Nakuha mo ung pera?,Nakuha mo ung pera?,nakuha ung pera,nakuha ung pera,tagalog
"W19 Games, Official partner with GCash, magdeposito gamit ang napiling GCash para makakuha ng 3% na cashback araw-araw!
https://v.ht/SM-p05","W19 Games, Official partner with GCash, magdeposito gamit ang napiling GCash para makakuha ng 3% na cashback araw-araw! https://v.ht/SM-p05",games official partner gcash magdeposito gamit napiling gcash makakuha cashback araw araw,games official partner gcash magdeposito gamit napiling makakuha araw,tagalog
"<REAL NAME>, mas pinasaya sa Wingo App! Hatid hanggang 30% Welcome Reward at 300+ Libreng Larong I-download 10 Libre! wingoph.com","<REAL NAME>, mas pinasaya sa Wingo App! Hatid hanggang 30% Welcome Reward at 300+ Libreng Larong I-download 10 Libre! wingoph.com",real name mas pinasaya wingo app hatid welcome reward libreng larong download libre,real name mas pinasaya hatid welcome reward libreng larong download libre,tagalog
"Yasss, eto ang FREEBONUS P5,000 para lang sayo! Mag-login sa http://pisogo.beauty/MpQ para makuha ito!","Yasss, eto ang FREEBONUS P5,000 para lang sayo! Mag-login sa http://pisogo.beauty/MpQ para makuha ito!",yasss eto freebonus lang sayo login makuha,eto lang sayo login makuha,tagalog
"Nagbibigay kami ng P10M bonus sa lahat ng nagamit ng W19 Games! Kontakin ang 24/7 support para sa LATEST WEBSITE. Iclaim ang sayo sa 
https://w19.ltd",Nagbibigay kami ng P10M bonus sa lahat ng nagamit ng W19 Games! Kontakin ang 24/7 support para sa LATEST WEBSITE. Iclaim ang sayo sa https://w19.ltd,nagbibigay m bonus nagamit games kontakin support latest website iclaim sayo,nagbibigay m bonus nagamit games kontakin support latest website sayo,tagalog
"Ano? Daily cashback at P777 na bonus? Halika at subukan lamang sa W19 Games!
w19b1.xyz",Ano? Daily cashback at P777 na bonus? Halika at subukan lamang sa W19 Games! w19b1.xyz,daily cashback bonus halika subukan games,daily bonus halika subukan games,tagalog
"Mag-sign up para makakuha ng 177P, at ang maximum na rebate para sa pagsali sa ahente ay 1.0%:   https://tg777.zone/?a=428232","Mag-sign up para makakuha ng 177P, at ang maximum na rebate para sa pagsali sa ahente ay 1.0%: https://tg777.zone/?a=428232",sign makakuha maximum rebate pagsali ahente,sign makakuha maximum rebate pagsali ahente,tagalog
"Mag-sign up para makakuha ng 177P, at ang maximum na rebate para sa pagsali sa ahente ay 1.0%:   https://tg777.zone/?a=428232","Mag-sign up para makakuha ng 177P, at ang maximum na rebate para sa pagsali sa ahente ay 1.0%: https://tg777.zone/?a=428232",sign makakuha maximum rebate pagsali ahente,sign makakuha maximum rebate pagsali ahente,tagalog
Magrehistro online para sa mga laro ng slot at makakuha ng P77: https://233704.store,Magrehistro online para sa mga laro ng slot at makakuha ng P77: https://233704.store,magrehistro online laro slot makakuha,magrehistro online laro slot makakuha,tagalog
Magrehistro online para sa mga laro ng slot at makakuha ng P77: https://233704.store,Magrehistro online para sa mga laro ng slot at makakuha ng P77: https://233704.store,magrehistro online laro slot makakuha,magrehistro online laro slot makakuha,tagalog
"W19 Games offers 100% na cashback para sa mga bagong dating, hanggang ?19800! Magparehistro at mag-claim ngayon!
w19w9.xyz","W19 Games offers 100% na cashback para sa mga bagong dating, hanggang ?19800! Magparehistro at mag-claim ngayon! w19w9.xyz",games offers cashback bagong dating magparehistro claim,games offers bagong dating magparehistro claim,tagalog
"Malugod kang tinatanggap ng PWIN777! Ang mga bagong miyembro ay maaaring magtamasa ng 100% benepisyo sa kanilang unang deposito na P197!
p777a1.xyz",Malugod kang tinatanggap ng PWIN777! Ang mga bagong miyembro ay maaaring magtamasa ng 100% benepisyo sa kanilang unang deposito na P197! p777a1.xyz,malugod kang tinatanggap bagong miyembro magtamasa benepisyo unang deposito,malugod kang tinatanggap bagong miyembro magtamasa benepisyo unang deposito,tagalog
"Ano? Daily cashback at ?777 na bonus? Halika at subukan lamang sa W19 Games!
w19w11.xyz",Ano? Daily cashback at ?777 na bonus? Halika at subukan lamang sa W19 Games! w19w11.xyz,daily cashback bonus halika subukan games,daily bonus halika subukan games,tagalog
"Una deposito ng 197,may kasamang 197,may pagkakataong manalo ng exclusive member Red Envelope na may halagang upto P77777 na premyo!

p777b16.site","Una deposito ng 197,may kasamang 197,may pagkakataong manalo ng exclusive member Red Envelope na may halagang upto P77777 na premyo! p777b16.site",deposito kasamang pagkakataong manalo exclusive member red envelope halagang upto premyo,deposito kasamang pagkakataong manalo exclusive member red envelope halagang premyo,tagalog
"Kumuha ng 100% Deposit Bonus sa 177BET! Doblehin ang iyong deposito ngayon! Huwag Palampasin!
177betb.xyz",Kumuha ng 100% Deposit Bonus sa 177BET! Doblehin ang iyong deposito ngayon! Huwag Palampasin! 177betb.xyz,deposit bonus doblehin deposito palampasin,deposit bonus doblehin deposito palampasin,tagalog
"100% na bonus sa unang deposito, hanggang 177777P!
177betg.xyz","100% na bonus sa unang deposito, hanggang 177777P! 177betg.xyz",bonus unang deposito,bonus unang deposito,tagalog
"jollibee777 Register para makatanggap ng 98p, taya
Maaari ka ring makakuha ng pulang envelope cash sa pamamagitan ng pag-sign in araw-araw
https://m.82388.xyz","jollibee777 Register para makatanggap ng 98p, taya Maaari ka ring makakuha ng pulang envelope cash sa pamamagitan ng pag-sign in araw-araw https://m.82388.xyz",register makatanggap taya ring makakuha pulang envelope cash pag sign araw araw,register makatanggap taya ring makakuha pulang envelope cash pag sign araw,tagalog
"Gawin ang iyong unang deposito ng 177P sa 177BET at makakuha ng 100% deposit bonus! Doblehin ang iyong deposito ngayon! Huwag itong palampasin!
177beta.xyz",Gawin ang iyong unang deposito ng 177P sa 177BET at makakuha ng 100% deposit bonus! Doblehin ang iyong deposito ngayon! Huwag itong palampasin! 177beta.xyz,gawin unang deposito makakuha deposit bonus doblehin deposito itong palampasin,gawin unang deposito makakuha deposit bonus doblehin itong palampasin,tagalog
"Gawin ang iyong unang deposito ng 177P sa 177BET at makakuha ng 100% deposit bonus! Doblehin ang iyong deposito ngayon! Huwag itong palampasin!
177betb.xyz",Gawin ang iyong unang deposito ng 177P sa 177BET at makakuha ng 100% deposit bonus! Doblehin ang iyong deposito ngayon! Huwag itong palampasin! 177betb.xyz,gawin unang deposito makakuha deposit bonus doblehin deposito itong palampasin,gawin unang deposito makakuha deposit bonus doblehin itong palampasin,tagalog
"Taos-puso kang iniimbitahan ng kumpanya ng 177BET na maging aming promoter! Ang sahod ay binabayaran araw-araw! Sana makasama ka sa amin!
aa.177beti.xyz/Fsd57",Taos-puso kang iniimbitahan ng kumpanya ng 177BET na maging aming promoter! Ang sahod ay binabayaran araw-araw! Sana makasama ka sa amin! aa.177beti.xyz/Fsd57,taos puso kang iniimbitahan kumpanya promoter sahod binabayaran araw araw sana makasama,taos puso kang iniimbitahan kumpanya promoter sahod binabayaran araw sana makasama,tagalog
"Mga nangungunang laro sa casino, bingo, at mga s10t machine, magrehistro at mag-deposito ng P100 upang makatanggap ng 100% cashback award.
p777b5.xyz","Mga nangungunang laro sa casino, bingo, at mga s10t machine, magrehistro at mag-deposito ng P100 upang makatanggap ng 100% cashback award. p777b5.xyz",nangungunang laro casino bingo machine magrehistro deposito upang makatanggap cashback award,nangungunang laro casino bingo machine magrehistro deposito upang makatanggap award,tagalog
"Gawin ang iyong unang deposito ng 177P sa 177BET at makakuha ng 100% deposit bonus! Doblehin ang iyong deposito ngayon! Huwag itong palampasin!
177betj.xyz",Gawin ang iyong unang deposito ng 177P sa 177BET at makakuha ng 100% deposit bonus! Doblehin ang iyong deposito ngayon! Huwag itong palampasin! 177betj.xyz,gawin unang deposito makakuha deposit bonus doblehin deposito itong palampasin,gawin unang deposito makakuha deposit bonus doblehin itong palampasin,tagalog
"Gawin ang iyong unang deposito ng 177P sa 177BET at makakuha ng 100% deposit bonus! Doblehin ang iyong deposito ngayon! Huwag itong palampasin!
177betm.xyz",Gawin ang iyong unang deposito ng 177P sa 177BET at makakuha ng 100% deposit bonus! Doblehin ang iyong deposito ngayon! Huwag itong palampasin! 177betm.xyz,gawin unang deposito makakuha deposit bonus doblehin deposito itong palampasin,gawin unang deposito makakuha deposit bonus doblehin itong palampasin,tagalog
"Gawin ang iyong unang deposito ng 177P sa 177BET at makakuha ng 100% deposit bonus! Doblehin ang iyong deposito ngayon! Huwag itong palampasin!
177beto.xyz",Gawin ang iyong unang deposito ng 177P sa 177BET at makakuha ng 100% deposit bonus! Doblehin ang iyong deposito ngayon! Huwag itong palampasin! 177beto.xyz,gawin unang deposito makakuha deposit bonus doblehin deposito itong palampasin,gawin unang deposito makakuha deposit bonus doblehin itong palampasin,tagalog
"Gawin ang iyong unang deposito ng 177P sa 177BET at makakuha ng 100% deposit bonus! Doblehin ang iyong deposito ngayon! Huwag itong palampasin!
177beto.xyz",Gawin ang iyong unang deposito ng 177P sa 177BET at makakuha ng 100% deposit bonus! Doblehin ang iyong deposito ngayon! Huwag itong palampasin! 177beto.xyz,gawin unang deposito makakuha deposit bonus doblehin deposito itong palampasin,gawin unang deposito makakuha deposit bonus doblehin itong palampasin,tagalog
"Gawin ang iyong unang deposito ng 177P sa 177BET at makakuha ng 100% deposit bonus! Doblehin ang iyong deposito ngayon! Huwag itong palampasin!
177betq.xyz",Gawin ang iyong unang deposito ng 177P sa 177BET at makakuha ng 100% deposit bonus! Doblehin ang iyong deposito ngayon! Huwag itong palampasin! 177betq.xyz,gawin unang deposito makakuha deposit bonus doblehin deposito itong palampasin,gawin unang deposito makakuha deposit bonus doblehin itong palampasin,tagalog
Magrehistro sa opisyal na online casino para makakuha ng 15P at mag recharge para makakuha ng 100% na engrandeng premyo na naghihintay para sa iyo bo6.xyz/yIv,Magrehistro sa opisyal na online casino para makakuha ng 15P at mag recharge para makakuha ng 100% na engrandeng premyo na naghihintay para sa iyo bo6.xyz/yIv,magrehistro opisyal online casino makakuha recharge makakuha engrandeng premyo naghihintay,magrehistro opisyal online casino makakuha recharge engrandeng premyo naghihintay,tagalog
"Una deposito ng 100p,may kasamang 100p,may pagkakataong manalo ng exclusive member Red Envelope na may halagang upto P77777 na premyo!
04p7.xyz/4ABL","Una deposito ng 100p,may kasamang 100p,may pagkakataong manalo ng exclusive member Red Envelope na may halagang upto P77777 na premyo! 04p7.xyz/4ABL",deposito kasamang pagkakataong manalo exclusive member red envelope halagang upto premyo,deposito kasamang pagkakataong manalo exclusive member red envelope halagang premyo,tagalog
"Mga nangungunang laro sa gambling house, bingo, at mga s10t machine, magrehistro at mag-deposito ng P100 upang makatanggap ng 100% cashback award
risu.io/F0Zis","Mga nangungunang laro sa gambling house, bingo, at mga s10t machine, magrehistro at mag-deposito ng P100 upang makatanggap ng 100% cashback award risu.io/F0Zis",nangungunang laro gambling house bingo machine magrehistro deposito upang makatanggap cashback award,nangungunang laro gambling house bingo machine magrehistro deposito upang makatanggap award,tagalog
"Bibigyan ka ng MAYA ng 100% na bonus sa iyong unang deposito
177bets.xyz",Bibigyan ka ng MAYA ng 100% na bonus sa iyong unang deposito 177bets.xyz,bibigyan maya bonus unang deposito,bibigyan maya bonus unang deposito,tagalog
"Sumali sa PWIN777! Tangkilikin ang pinakamahusay na deposito at pulang sobre na alok! Sa unang deposito na P100, may 100% bonus!
risu.io/pB4Ko","Sumali sa PWIN777! Tangkilikin ang pinakamahusay na deposito at pulang sobre na alok! Sa unang deposito na P100, may 100% bonus! risu.io/pB4Ko",sumali tangkilikin pinakamahusay deposito pulang sobre alok unang deposito bonus,sumali tangkilikin pinakamahusay deposito pulang sobre alok unang bonus,tagalog
"Bibigyan ka ng MAYA ng 100% na bonus sa iyong unang deposito
177bets.xyz",Bibigyan ka ng MAYA ng 100% na bonus sa iyong unang deposito 177bets.xyz,bibigyan maya bonus unang deposito,bibigyan maya bonus unang deposito,tagalog
Magdeposito ng 100P sa opisyal na laro ng i01 makakuha ng 100% na bonus at naghihintay sa iyo ang malalaking premyo bo6.xyz/tkd,Magdeposito ng 100P sa opisyal na laro ng i01 makakuha ng 100% na bonus at naghihintay sa iyo ang malalaking premyo bo6.xyz/tkd,magdeposito opisyal laro makakuha bonus naghihintay malalaking premyo,magdeposito opisyal laro makakuha bonus naghihintay malalaking premyo,tagalog
"Unang deposito 100p, bonus 100p, imbitahan ang mga kaibigan bonus 77p risu.io/RXz9E","Unang deposito 100p, bonus 100p, imbitahan ang mga kaibigan bonus 77p risu.io/RXz9E",unang deposito bonus imbitahan kaibigan bonus,unang deposito bonus imbitahan kaibigan,tagalog
