text,ctext,stopwords_removed,cleaned_text,language
"Goodluck! ang swerte mong tao sa EPICWIN may pag asa kang manalo ng 50k sa 5 pesos na bet mo! plus VIP rewards pa! laro na website: EpcWln.eu
 maglaro ngayun!",Goodluck! ang swerte mong tao sa EPICWIN may pag asa kang manalo ng 50k sa 5 pesos na bet mo! plus VIP rewards pa! laro na website: EpcWln.eu maglaro ngayun!,goodluck swerte mong tao epicwin pag asa kang manalo pesos bet plus vip rewards laro website maglaro ngayun,goodluck swerte mong tao pag asa kang manalo pesos bet plus vip rewards laro website maglaro ngayun,tagalog
"Kumusta,<REAL NAME> Sumali sa CO777 at may free 88 ka agad! Mag-click dito: titok.la/4f4z para magsimula!","Kumusta,<REAL NAME> Sumali sa CO777 at may free 88 ka agad! Mag-click dito: titok.la/4f4z para magsimula!",name sumali free agad click magsimula,name sumali free agad click magsimula,tagalog
"Kumusta,<REAL NAME> Sumali sa CO777 at may free 88 ka agad! Mag-click dito: titok.la/4f4z para magsimula!","Kumusta,<REAL NAME> Sumali sa CO777 at may free 88 ka agad! Mag-click dito: titok.la/4f4z para magsimula!",name sumali free agad click magsimula,name sumali free agad click magsimula,tagalog
"Psst,<REAL NAME>gusto mo ba ng libre? CO777,magbigay ng 88 pag mag-register ka. Dalawin ang: titok.la/biyp !","Psst,<REAL NAME>gusto mo ba ng libre? CO777,magbigay ng 88 pag mag-register ka. Dalawin ang: titok.la/biyp !",name ba libre pag register dalawin,name ba libre pag register dalawin,tagalog
"Palakihin ang iyong mga kita gamit ang 100% Welcome Bonus Magdeposit ngayon at manalo ng malaki!
website: epcw.eu
 maglaro ngayun!",Palakihin ang iyong mga kita gamit ang 100% Welcome Bonus Magdeposit ngayon at manalo ng malaki! website: epcw.eu maglaro ngayun!,palakihin kita gamit welcome bonus magdeposit manalo malaki website maglaro ngayun,palakihin kita gamit welcome bonus manalo malaki website maglaro ngayun,tagalog
"Goodluck! ang swerte mong tao sa EPICWIN may pag asa kang manalo ng 50k sa 5 pesos na bet mo! plus VIP rewards pa! laro na website: epcw.eu
 maglaro ngayun!",Goodluck! ang swerte mong tao sa EPICWIN may pag asa kang manalo ng 50k sa 5 pesos na bet mo! plus VIP rewards pa! laro na website: epcw.eu maglaro ngayun!,goodluck swerte mong tao epicwin pag asa kang manalo pesos bet plus vip rewards laro website maglaro ngayun,goodluck swerte mong tao pag asa kang manalo pesos bet plus vip rewards laro website maglaro ngayun,tagalog
"FG777: Ang bagong 1999 na libreng b0nus ay random na ipapamahagi sa lalong madaling panahon.Mag-log in ngayon para makatanggap
f77gg.ac/700",FG777: Ang bagong 1999 na libreng b0nus ay random na ipapamahagi sa lalong madaling panahon.Mag-log in ngayon para makatanggap f77gg.ac/700,bagong libreng random ipapamahagi lalong madaling log makatanggap,bagong libreng random ipapamahagi lalong madaling log makatanggap,tagalog
Magrehistro bilang isang miyembro at makakuha ng mga bonus! is sa1y7n7lbc.uk,Magrehistro bilang isang miyembro at makakuha ng mga bonus! is sa1y7n7lbc.uk,magrehistro miyembro makakuha bonus,magrehistro miyembro makakuha bonus,tagalog
Sali na sa ating photo contest promotion upang manalo ng kamangha-manghang premyo 666cc.la/Ej2D,Sali na sa ating photo contest promotion upang manalo ng kamangha-manghang premyo 666cc.la/Ej2D,sali photo contest promotion upang manalo kamangha manghang premyo,sali photo contest promotion upang manalo manghang premyo,tagalog
Magrehistro bilang isang miyembro at makakuha ng mga bonus! is suz17s7bct.uk,Magrehistro bilang isang miyembro at makakuha ng mga bonus! is suz17s7bct.uk,magrehistro miyembro makakuha bonus,magrehistro miyembro makakuha bonus,tagalog
"Ikaw ang maswerteng 5JL
Makatanggap ng P555 na 
bonus >>> ras525.pgwinwin.fi",Ikaw ang maswerteng 5JL Makatanggap ng P555 na bonus >>> ras525.pgwinwin.fi,maswerteng makatanggap bonus,maswerteng makatanggap bonus,tagalog
"Mag-log in para makatanggap ng hanggang 555, at magkaroon din ng pagkakataong manalo ng IPhone15Pro >>>  klv7o7bbea.uk","Mag-log in para makatanggap ng hanggang 555, at magkaroon din ng pagkakataong manalo ng IPhone15Pro >>> klv7o7bbea.uk",log makatanggap magkaroon pagkakataong manalo,log makatanggap magkaroon pagkakataong manalo,tagalog
"Hi,May libreng 77 ka kapag nag-download ka ng APP! I-click na dito para simulan: mar-t.eu/gzxw !","Hi,May libreng 77 ka kapag nag-download ka ng APP! I-click na dito para simulan: mar-t.eu/gzxw !",hi libreng nag download app click simulan,hi libreng nag download click simulan,tagalog
"Uy,Alam mo ba,may 18-888 raffle ticket ka at libreng 77 sa pag-download ng APP! Check mo dito: mar-t.eu/vrtv !","Uy,Alam mo ba,may 18-888 raffle ticket ka at libreng 77 sa pag-download ng APP! Check mo dito: mar-t.eu/vrtv !",uy alam ba raffle ticket libreng pag download app check,uy alam ba raffle ticket libreng pag download check,tagalog
"Hi,Andito na ang reward mo! Sa tatlong simpleng hakbang,makakakuha ka ng 18+77+300. Tingnan dito: mar-t.eu/ertaz !","Hi,Andito na ang reward mo! Sa tatlong simpleng hakbang,makakakuha ka ng 18+77+300. Tingnan dito: mar-t.eu/ertaz !",hi andito reward tatlong simpleng hakbang makakakuha tingnan,hi andito reward tatlong simpleng hakbang makakakuha tingnan,tagalog
"ang galing! Mag-register ka lang,may 18-888,download ng APP,dagdag 77. First deposit? Boom,dagdag 300! Kunin na: mar-t.eu/biw8 !","ang galing! Mag-register ka lang,may 18-888,download ng APP,dagdag 77. First deposit? Boom,dagdag 300! Kunin na: mar-t.eu/biw8 !",galing register lang app dagdag first deposit boom dagdag kunin,galing register lang dagdag first deposit boom kunin,tagalog
"Hey,Alam mo ba? Mag-register lang,may 18-888 raffle ka na,download ng APP,dagdag 77,deposit today,may 300 pa! Bisitahin: mar-t.eu/gzfv !","Hey,Alam mo ba? Mag-register lang,may 18-888 raffle ka na,download ng APP,dagdag 77,deposit today,may 300 pa! Bisitahin: mar-t.eu/gzfv !",hey alam ba register lang raffle download app dagdag today bisitahin,hey alam ba register lang raffle download dagdag today bisitahin,tagalog
"Hello,<REAL NAME>! Ang swerte mo talaga! Nakuha mo ang 18-888 raffle ticket! Pindutin na: ga-me.eu/gzzr para kunin ang bonus mo!","Hello,<REAL NAME>! Ang swerte mo talaga! Nakuha mo ang 18-888 raffle ticket! Pindutin na: ga-me.eu/gzzr para kunin ang bonus mo!",name swerte talaga nakuha raffle ticket pindutin kunin bonus,name swerte talaga nakuha raffle ticket pindutin kunin bonus,tagalog
"Super Welcome bonus hanggang 3000 pesos ang maaring makuhang libre sa 100% welcome bonus + 50% Live Casino Bonus ! website : EpicWinLuck.de
",Super Welcome bonus hanggang 3000 pesos ang maaring makuhang libre sa 100% welcome bonus + 50% Live Casino Bonus ! website : EpicWinLuck.de,super welcome bonus pesos maaring makuhang libre welcome bonus live casino bonus website,super welcome bonus pesos maaring makuhang libre live casino website,tagalog
Sa tuwing tumataya ako sa l8shj7177a.uk/?akk890cn nananalo ako ng pera. Nagdeposito ako ng 500P at nanalo ng 10K. Sana ay kumita ka ng balitang ito.,Sa tuwing tumataya ako sa l8shj7177a.uk/?akk890cn nananalo ako ng pera. Nagdeposito ako ng 500P at nanalo ng 10K. Sana ay kumita ka ng balitang ito.,tuwing tumataya nananalo pera nagdeposito nanalo sana kumita balitang,tuwing tumataya nananalo pera nanalo sana kumita balitang,tagalog
Sa tuwing tumataya ako sa l25aa4shui.uk/?20ssak1a nananalo ako ng pera. Nagdeposito ako ng 500P at nanalo ng 10K. Sana ay kumita ka ng balitang ito.,Sa tuwing tumataya ako sa l25aa4shui.uk/?20ssak1a nananalo ako ng pera. Nagdeposito ako ng 500P at nanalo ng 10K. Sana ay kumita ka ng balitang ito.,tuwing tumataya nananalo pera nagdeposito nanalo sana kumita balitang,tuwing tumataya nananalo pera nanalo sana kumita balitang,tagalog
"Kumuha ng libreng P167, mag-lagay lamang ng P102 upang makuha: claimcenter.uk","Kumuha ng libreng P167, mag-lagay lamang ng P102 upang makuha: claimcenter.uk",libreng lagay upang makuha,libreng lagay upang makuha,tagalog
Na refund na sa iyong account ang P2160. Mag register at maglagay ng P100 upang makuha: vvgo.uk,Na refund na sa iyong account ang P2160. Mag register at maglagay ng P100 upang makuha: vvgo.uk,refund account register maglagay upang makuha,refund account register maglagay upang makuha,tagalog
"Huwag magpahuli! Sumali na sa Rounds Challenge sa spnsmore.eu at manalo ng 100K Pesos, may LIBRENG BONUS pa!","Huwag magpahuli! Sumali na sa Rounds Challenge sa spnsmore.eu at manalo ng 100K Pesos, may LIBRENG BONUS pa!",magpahuli sumali rounds challenge manalo k pesos libreng bonus,magpahuli sumali rounds challenge manalo k pesos libreng bonus,tagalog
phprize.uk << Claim here! Nanalo ka ng P2760! Kunin na ang inyong premyo ngayon! Bisitahin ang link na ito upang makuha ang inyong napanalunan.,phprize.uk << Claim here! Nanalo ka ng P2760! Kunin na ang inyong premyo ngayon! Bisitahin ang link na ito upang makuha ang inyong napanalunan.,claim nanalo kunin premyo bisitahin link upang makuha napanalunan,claim nanalo kunin premyo bisitahin link upang makuha napanalunan,tagalog
phcasino.uk << Claim here! Nanalo ka ng P2760! Kunin na ang inyong premyo ngayon! Bisitahin ang link na ito upang makuha ang inyong napanalunan.,phcasino.uk << Claim here! Nanalo ka ng P2760! Kunin na ang inyong premyo ngayon! Bisitahin ang link na ito upang makuha ang inyong napanalunan.,claim nanalo kunin premyo bisitahin link upang makuha napanalunan,claim nanalo kunin premyo bisitahin link upang makuha napanalunan,tagalog
Nanalo ako ng pera tuwing tumaya ako ng 500P at nanalo ng 10K. Maaaring ito ay isang BUG. Sumali ako sa lvv65a118l.uk/?6fg5dds,Nanalo ako ng pera tuwing tumaya ako ng 500P at nanalo ng 10K. Maaaring ito ay isang BUG. Sumali ako sa lvv65a118l.uk/?6fg5dds,nanalo pera tuwing tumaya nanalo bug sumali,nanalo pera tuwing tumaya bug sumali,tagalog
phvegas.uk <-- Claim here! Nanalo ka ng P2760! Maglagay lamang ng P100 upang makuha ang panalo!,phvegas.uk <-- Claim here! Nanalo ka ng P2760! Maglagay lamang ng P100 upang makuha ang panalo!,claim nanalo maglagay upang makuha panalo,claim nanalo maglagay upang makuha panalo,tagalog
phvegas.uk <-- Claim here! Nanalo ka ng P2760! Maglagay lamang ng P100 upang makuha ang panalo!,phvegas.uk <-- Claim here! Nanalo ka ng P2760! Maglagay lamang ng P100 upang makuha ang panalo!,claim nanalo maglagay upang makuha panalo,claim nanalo maglagay upang makuha panalo,tagalog
Kaya mo bang manalo sa Spins Rounds Challenge? Ito ang iyong pagkakataon para makamit ang bagong Yamaha Mio Gravis! Tuklasin ang mga premyo sa spswins.eu !,Kaya mo bang manalo sa Spins Rounds Challenge? Ito ang iyong pagkakataon para makamit ang bagong Yamaha Mio Gravis! Tuklasin ang mga premyo sa spswins.eu !,bang manalo spins rounds challenge pagkakataon makamit bagong yamaha mio gravis tuklasin premyo,bang manalo rounds challenge pagkakataon makamit bagong yamaha mio tuklasin premyo,tagalog
Nanalo ako ng pera tuwing tumaya ako ng 500P at nanalo ng 10K. Maaaring ito ay isang BUG. Sumali ako sa lvv65a118l.uk/?098ccv5ss,Nanalo ako ng pera tuwing tumaya ako ng 500P at nanalo ng 10K. Maaaring ito ay isang BUG. Sumali ako sa lvv65a118l.uk/?098ccv5ss,nanalo pera tuwing tumaya nanalo bug sumali,nanalo pera tuwing tumaya bug sumali,tagalog
winner4bonus.uk <-- Claim here! Nanalo ka ng P2760! Maglagay lamang ng P50 upang makuha ang panalo!,winner4bonus.uk <-- Claim here! Nanalo ka ng P2760! Maglagay lamang ng P50 upang makuha ang panalo!,claim nanalo maglagay upang makuha panalo,claim nanalo maglagay upang makuha panalo,tagalog
lucky7charm.uk <<< Claim here! Nanalo ka ng P2760! Kunin na ang inyong premyo ngayon! Bisitahin ang link na ito upang makuha ang inyong napanalunan.,lucky7charm.uk <<< Claim here! Nanalo ka ng P2760! Kunin na ang inyong premyo ngayon! Bisitahin ang link na ito upang makuha ang inyong napanalunan.,claim nanalo kunin premyo bisitahin link upang makuha napanalunan,claim nanalo kunin premyo bisitahin link upang makuha napanalunan,tagalog
Sa tuwing tumataya ako sa lvv65a118l.uk/?9as7fkg8fs nananalo ako ng pera. Nagdeposito ako ng 500P at nanalo ng 10K. Sana ay kumita ka ng balitang ito.,Sa tuwing tumataya ako sa lvv65a118l.uk/?9as7fkg8fs nananalo ako ng pera. Nagdeposito ako ng 500P at nanalo ng 10K. Sana ay kumita ka ng balitang ito.,tuwing tumataya nananalo pera nagdeposito nanalo sana kumita balitang,tuwing tumataya nananalo pera nanalo sana kumita balitang,tagalog
Ikaw ang maswerteng Makatanggap ng P555 na  bonus >>>  lvv65a118l.uk/?bmn7v6fyt,Ikaw ang maswerteng Makatanggap ng P555 na bonus >>> lvv65a118l.uk/?bmn7v6fyt,maswerteng makatanggap bonus,maswerteng makatanggap bonus,tagalog
May P2580 credit natanggap ang number na ito! Ito ay valid lamang within 8 hrs! Magregister at maglagay ng P50 upang maclaim sa aming 24/7 CS: cxbz.de,May P2580 credit natanggap ang number na ito! Ito ay valid lamang within 8 hrs! Magregister at maglagay ng P50 upang maclaim sa aming 24/7 CS: cxbz.de,credit natanggap number valid within hrs magregister maglagay upang maclaim cs,credit natanggap number valid within hrs maglagay upang cs,tagalog
May P2580 credit natanggap ang number na ito! Ito ay valid lamang within 8 hrs! Magregister at maglagay ng P50 upang maclaim sa aming 24/7 CS: iopq.de,May P2580 credit natanggap ang number na ito! Ito ay valid lamang within 8 hrs! Magregister at maglagay ng P50 upang maclaim sa aming 24/7 CS: iopq.de,credit natanggap number valid within hrs magregister maglagay upang maclaim cs,credit natanggap number valid within hrs maglagay upang cs,tagalog
May P2580 credit natanggap ang number na ito! Ito ay valid lamang within 8 hrs! Magregister at maglagay ng P50 upang maclaim sa aming 24/7 CS: iopq.de,May P2580 credit natanggap ang number na ito! Ito ay valid lamang within 8 hrs! Magregister at maglagay ng P50 upang maclaim sa aming 24/7 CS: iopq.de,credit natanggap number valid within hrs magregister maglagay upang maclaim cs,credit natanggap number valid within hrs maglagay upang cs,tagalog
Nanalo ako ng pera tuwing tumaya ako ng 500P at nanalo ng 10K. Maaaring ito ay isang BUG. Sumali ako sa lvv65a118l.uk,Nanalo ako ng pera tuwing tumaya ako ng 500P at nanalo ng 10K. Maaaring ito ay isang BUG. Sumali ako sa lvv65a118l.uk,nanalo pera tuwing tumaya nanalo bug sumali,nanalo pera tuwing tumaya bug sumali,tagalog
May P2580 credit natanggap ang number na ito! Ito ay valid lamang within 8 hrs! Magregister at maglagay ng P50 upang maclaim sa aming 24/7 CS: zaqw.de,May P2580 credit natanggap ang number na ito! Ito ay valid lamang within 8 hrs! Magregister at maglagay ng P50 upang maclaim sa aming 24/7 CS: zaqw.de,credit natanggap number valid within hrs magregister maglagay upang maclaim cs,credit natanggap number valid within hrs maglagay upang cs,tagalog
Sa tuwing tumataya ako sa lvv65a118l.uk nananalo ako ng pera. Nagdeposito ako ng 500P at nanalo ng 10K. Sana ay kumita ka ng balitang ito.,Sa tuwing tumataya ako sa lvv65a118l.uk nananalo ako ng pera. Nagdeposito ako ng 500P at nanalo ng 10K. Sana ay kumita ka ng balitang ito.,tuwing tumataya nananalo pera nagdeposito nanalo sana kumita balitang,tuwing tumataya nananalo pera nanalo sana kumita balitang,tagalog
May P6140 credit natanggap ang number na ito! Ito ay valid lamang within 8 hrs! Magregister at maglagay ng P50 upang maclaim sa aming 24/7 CS: phee.so,May P6140 credit natanggap ang number na ito! Ito ay valid lamang within 8 hrs! Magregister at maglagay ng P50 upang maclaim sa aming 24/7 CS: phee.so,credit natanggap number valid within hrs magregister maglagay upang maclaim cs,credit natanggap number valid within hrs maglagay upang cs,tagalog
May P6140 na natanggap ang number na ito! Ito ay valid lamang within 8 hrs! Maglagay ng P50 upang maclaim sa aming 24/7 CS: mwjt.uk,May P6140 na natanggap ang number na ito! Ito ay valid lamang within 8 hrs! Maglagay ng P50 upang maclaim sa aming 24/7 CS: mwjt.uk,natanggap number valid within hrs maglagay upang maclaim cs,natanggap number valid within hrs maglagay upang cs,tagalog
May P2580 credit natanggap ang number na ito! Ito ay valid lamang within 8 hrs! Magregister at maglagay ng P50 upang maclaim sa aming 24/7 CS: cxlk.uk,May P2580 credit natanggap ang number na ito! Ito ay valid lamang within 8 hrs! Magregister at maglagay ng P50 upang maclaim sa aming 24/7 CS: cxlk.uk,credit natanggap number valid within hrs magregister maglagay upang maclaim cs,credit natanggap number valid within hrs maglagay upang cs,tagalog
Ikaw ang maswerteng Makatanggap ng P555 na  bonus >>>  yg54yt7r7y.uk,Ikaw ang maswerteng Makatanggap ng P555 na bonus >>> yg54yt7r7y.uk,maswerteng makatanggap bonus,maswerteng makatanggap bonus,tagalog
Nanalo ako ng pera tuwing tumaya ako ng 500P at nanalo ng 10K. Maaaring ito ay isang BUG. Sumali ako sa ycx43ew7rt.uk,Nanalo ako ng pera tuwing tumaya ako ng 500P at nanalo ng 10K. Maaaring ito ay isang BUG. Sumali ako sa ycx43ew7rt.uk,nanalo pera tuwing tumaya nanalo bug sumali,nanalo pera tuwing tumaya bug sumali,tagalog
100k Jackp0t na naman! Ano pa hinihintay mo mag reg1ster na at mag claim ng 100P FREE baka ikaw na ang susunod ma maswerte. ODQZZ.eu,100k Jackp0t na naman! Ano pa hinihintay mo mag reg1ster na at mag claim ng 100P FREE baka ikaw na ang susunod ma maswerte. ODQZZ.eu,naman hinihintay claim free baka susunod ma maswerte,naman hinihintay claim free baka susunod ma maswerte,tagalog
Nalagay na sa iyong number ang P2500. Sumali gamit ang number na ito at maglagay ng P50 upang makuha: hnvb.uk,Nalagay na sa iyong number ang P2500. Sumali gamit ang number na ito at maglagay ng P50 upang makuha: hnvb.uk,nalagay number sumali gamit number maglagay upang makuha,nalagay number sumali gamit maglagay upang makuha,tagalog
"Ikaw ang maswerteng
Makatanggap ng P888 na 
bonus >>> supervvvip.ca  ",Ikaw ang maswerteng Makatanggap ng P888 na bonus >>> supervvvip.ca,maswerteng makatanggap bonus,maswerteng makatanggap bonus,tagalog
Nakatanggap ang iyong number ng P7748. Mag-register gamit ang number na ito at maglaro ng halagang P10 upang makuha. Sumali dito: nowjam.de,Nakatanggap ang iyong number ng P7748. Mag-register gamit ang number na ito at maglaro ng halagang P10 upang makuha. Sumali dito: nowjam.de,nakatanggap number register gamit number maglaro halagang upang makuha sumali,nakatanggap number register gamit maglaro halagang upang makuha sumali,tagalog
Nanalo ang number mo ng P2874! Mag-register gamit ang number na ito upang makuha and premyo. Sumali dito: antfig.de,Nanalo ang number mo ng P2874! Mag-register gamit ang number na ito upang makuha and premyo. Sumali dito: antfig.de,nanalo number register gamit number upang makuha premyo sumali,nanalo number register gamit upang makuha premyo sumali,tagalog
"Ikaw ang maswerteng
Makatanggap ng P555 na 
bonus >>> tssccc.pgwinwin.ca  ",Ikaw ang maswerteng Makatanggap ng P555 na bonus >>> tssccc.pgwinwin.ca,maswerteng makatanggap bonus,maswerteng makatanggap bonus,tagalog
YG777 Nakatanggap ang iyong number ng P7748. Mag-register gamit ang number na ito at maglaro ng halagang P10 upang makuha. Sumali dito: boxlid.de,YG777 Nakatanggap ang iyong number ng P7748. Mag-register gamit ang number na ito at maglaro ng halagang P10 upang makuha. Sumali dito: boxlid.de,nakatanggap number register gamit number maglaro halagang upang makuha sumali,nakatanggap number register gamit maglaro halagang upang makuha sumali,tagalog
100 pesos mo gawin nating 200!  Copy this to browser [ kklfph.fyi ] to get!,100 pesos mo gawin nating 200! Copy this to browser [ kklfph.fyi ] to get!,pesos gawin nating copy browser get,pesos gawin nating copy browser get,tagalog
YG777 Nakatanggap ang iyong number ng P7748. Mag-register gamit ang number na ito at maglaro ng halagang P10 upang makuha. Sumali dito: joypod.de,YG777 Nakatanggap ang iyong number ng P7748. Mag-register gamit ang number na ito at maglaro ng halagang P10 upang makuha. Sumali dito: joypod.de,nakatanggap number register gamit number maglaro halagang upang makuha sumali,nakatanggap number register gamit maglaro halagang upang makuha sumali,tagalog
Nakatanggap ang iyong number ng P7748. Mag-register gamit ang number na ito at maglaro ng halagang P10 upang makuha. Sumali dito: joypod.de.,Nakatanggap ang iyong number ng P7748. Mag-register gamit ang number na ito at maglaro ng halagang P10 upang makuha. Sumali dito: joypod.de.,nakatanggap number register gamit number maglaro halagang upang makuha sumali,nakatanggap number register gamit maglaro halagang upang makuha sumali,tagalog
Nakatanggap ang iyong number ng P7748. Mag-register gamit ang number na ito at maglaro ng halagang P10 upang makuha. Sumali dito: boxjam.de.,Nakatanggap ang iyong number ng P7748. Mag-register gamit ang number na ito at maglaro ng halagang P10 upang makuha. Sumali dito: boxjam.de.,nakatanggap number register gamit number maglaro halagang upang makuha sumali,nakatanggap number register gamit maglaro halagang upang makuha sumali,tagalog
Nakatanggap ang iyong number ng P7748. Mag-register gamit ang number na ito at maglaro ng halagang P10 upang makuha. Sumali dito: yystf5ree.nl,Nakatanggap ang iyong number ng P7748. Mag-register gamit ang number na ito at maglaro ng halagang P10 upang makuha. Sumali dito: yystf5ree.nl,nakatanggap number register gamit number maglaro halagang upang makuha sumali,nakatanggap number register gamit maglaro halagang upang makuha sumali,tagalog
Mag-register na sa EPwin at makakuha ng 180% Welcome Bonus hanggang 15k pesos + 1.2% araw-araw na rebate sa epicgamb.de! Huwag palampasin!,Mag-register na sa EPwin at makakuha ng 180% Welcome Bonus hanggang 15k pesos + 1.2% araw-araw na rebate sa epicgamb.de! Huwag palampasin!,register epwin makakuha welcome bonus pesos araw araw rebate palampasin,register makakuha welcome bonus pesos araw rebate palampasin,tagalog
"Nanalo ng Jackp0t! Nanalo ka ng Prize na P64,347! I-download na para makakuha ng P57 nang libre. Makakuha ng 128 libre para sa 1st Deposit. gghnm.dhaui.ca  ","Nanalo ng Jackp0t! Nanalo ka ng Prize na P64,347! I-download na para makakuha ng P57 nang libre. Makakuha ng 128 libre para sa 1st Deposit. gghnm.dhaui.ca",nanalo nanalo prize download makakuha nang libre makakuha libre deposit,nanalo prize download makakuha nang libre deposit,tagalog
Nanalo ako ng pera tuwing tumaya ako ng 500P at nanalo ng 10K. Maaaring ito ay isang BUG. Sumali ako sa URL: 177bet. xyz,Nanalo ako ng pera tuwing tumaya ako ng 500P at nanalo ng 10K. Maaaring ito ay isang BUG. Sumali ako sa URL: 177bet. xyz,nanalo pera tuwing tumaya nanalo bug sumali url xyz,nanalo pera tuwing tumaya bug sumali xyz,tagalog
Ikaw ang maswerteng Makatanggap ng P555 na bonus >>>  URL: 177bet. xyz,Ikaw ang maswerteng Makatanggap ng P555 na bonus >>> URL: 177bet. xyz,maswerteng makatanggap bonus url xyz,maswerteng makatanggap bonus xyz,tagalog
Nakatanggap ang iyong number ng P7748. Mag-register gamit ang number na ito at maglaro ng halagang P10 upang makuha. Sumali dito: xpio76ytr.la,Nakatanggap ang iyong number ng P7748. Mag-register gamit ang number na ito at maglaro ng halagang P10 upang makuha. Sumali dito: xpio76ytr.la,nakatanggap number register gamit number maglaro halagang upang makuha sumali,nakatanggap number register gamit maglaro halagang upang makuha sumali,tagalog
"BigWln, nanalo ka ng Prize: P39,259. Magparehistro Makakuha ng P17~Maglaro ng P50 Makakuha ng P57. Libreng P128 para sa unang deposito~ gdubw.social  ","BigWln, nanalo ka ng Prize: P39,259. Magparehistro Makakuha ng P17~Maglaro ng P50 Makakuha ng P57. Libreng P128 para sa unang deposito~ gdubw.social",bigwln nanalo prize magparehistro makakuha maglaro makakuha libreng unang,nanalo prize magparehistro makakuha maglaro libreng unang,tagalog
